User,Comment,Likes,Published At,Time Ago
@lazur1,"He didn't wanna kill the guy, & he DIDN'T kill the guy. The guy kept breathing, & kept resisting. He was alive when the police arrived. People don't die *hours* later from are previous so-called ""choke hold"".",13,2024-12-10T23:57:40Z,2024-12-10T23:57:40Z
@laurenanderson9025,"Jon Stewart's audience is made up primarily of sociopaths, as they demonstrated. Gosh, I wonder what it is in Jon's show that attracts sociopaths? THERE'S a sociological study waiting to be written.",0,2024-12-10T23:51:53Z,2024-12-10T23:51:53Z
@richard4short5,The Left is a mob.,0,2024-12-10T23:50:52Z,2024-12-10T23:50:52Z
@stephensalter570,I’ll bet Mangione was an ANTIFA activist in times past.,0,2024-12-10T23:49:36Z,2024-12-10T23:49:36Z
@1cariyoung,🇺🇲💜🇺🇲💜🇺🇲 PENNY 🇺🇲💜🇺🇲💜🇺🇲,0,2024-12-10T23:47:18Z,2024-12-10T23:47:18Z
@Lou0830,Sounds like the family is setting up a civil wrongful death lawsuit. Disgusting imo. Anything for a dollar.,1,2024-12-10T23:45:02Z,2024-12-10T23:45:02Z
@kbc1883,"I like you, Dave and I am conservative, but holy cow you say some outlandish BS!  Societies have ALWAYS cheered the demise of the overlords, have celebrated the downfall of the elite who have been cruel and starved their families of the resources they need.  Our country celebrates July 4th, the honoring of when our founding fathers overthrew and killed the oppressors.  More recently the USA cheered the assassination of Osma Bin Laden.  I am quite sure more people watching your show have lost loved ones or had their lives deeply negatively impacted by greedy health insurance companies than by Osama Bin Laden.  So yes, the peasants are celebrating the murder of the king who has had a strnaghold on their lives.",0,2024-12-10T23:44:19Z,2024-12-10T23:45:19Z
@BrewmasterN8,"18:47 who is that guy?  Where was he when it mattered... These BLM ignoramuses need to actually wake up.   
Listen to them CALL FOR VIOLENCE.   Can someone arrest this man for calling on his followers to enact violence on whites?   Wtf",0,2024-12-10T23:41:53Z,2024-12-10T23:41:53Z
@TurboPonies,20:59 How’s that not being an incitement of violence exactly?,0,2024-12-10T23:37:56Z,2024-12-10T23:37:56Z
@daddski1,so mangioni couldnt have sex BUT COULD TRAVEL AND GO SURFING???   poor mannn,0,2024-12-10T23:35:04Z,2024-12-10T23:35:04Z
@genedowen9183,"Loved that CG opening LOL.
As for Courage -- ""Courage is being scared to death, but saddling up anyway"" - John Wayne.",0,2024-12-10T23:35:03Z,2024-12-10T23:52:23Z
@javaskull88,“Make your own chart.”  Love it!,0,2024-12-10T23:34:50Z,2024-12-10T23:34:50Z
@imopman,"We have trained moose and beavers, beware !",0,2024-12-10T23:34:09Z,2024-12-10T23:34:09Z
@yehoshuabenavraham9706,"AI is not an unmixed blessing. We will need legislation with teeth to deal with the use of the neurolink, deep fakes, implanted chips of whatever size, robots, and all of the rest.",0,2024-12-10T23:33:43Z,2024-12-10T23:33:43Z
@Puchunguita2792,I really like Rand Paul 👍🏼,2,2024-12-10T23:27:50Z,2024-12-10T23:27:50Z
@royborrill2711,You can take the animal out of the jungle but you can't take the jungle out of the animal,2,2024-12-10T23:20:05Z,2024-12-10T23:20:05Z
@Pir8at50,Loved “Summer Rental”,0,2024-12-10T23:16:48Z,2024-12-10T23:16:48Z
@LightsCameraKonkle,That opening!,2,2024-12-10T23:15:03Z,2024-12-10T23:15:03Z
@mmcgahn5948,"Ironically, a multi-million dollar salaried CEO from Minnesota…. I’d bet he voted Democrat",0,2024-12-10T23:13:37Z,2024-12-10T23:13:37Z
@SereneWaller,Penny should NEVER have been charged.,81,2024-12-10T23:12:50Z,2024-12-10T23:13:23Z
@Opedanderson,But without this violence would u even be talking about this,1,2024-12-10T23:12:13Z,2024-12-10T23:12:13Z
@lesamcclain7148,"6 was a Marine, not Navy",0,2024-12-10T23:10:20Z,2024-12-10T23:10:20Z
@Opedanderson,Carbon copy of Lee Harvey Oswald,0,2024-12-10T23:08:37Z,2024-12-10T23:08:37Z
@baneverything5580,"""The system is rigged against us violent criminals...yo!""",0,2024-12-10T23:07:10Z,2024-12-10T23:07:10Z
@lesamcclain7148,It doesn't seem like it hurts the father that much.,2,2024-12-10T23:06:00Z,2024-12-10T23:06:00Z
@fishhuntr,Just so people who may not know we have a huge trade with Canada when it comes to building materials. Most drywall lumber and metal framing is coming from Canada.  Its not just hockey sticks and maple syrup.,0,2024-12-10T23:03:31Z,2024-12-10T23:03:31Z
@bobbastian760,"Don't hate the player, hate the game.",0,2024-12-10T23:03:16Z,2024-12-10T23:03:16Z
@stevenkelley9002,O Canada ... 🙄,0,2024-12-10T23:02:38Z,2024-12-10T23:02:38Z
@dens3096,"I really think Stewart expected booong because lets face it, majority of Americans wished he didn’t get caught",0,2024-12-10T22:59:14Z,2024-12-10T22:59:14Z
@TCHING25,His family didn't want to give him a place to live??? But he's able to terrorize strangers?? They know he was crazy. As a black woman I know they want a payday.,1,2024-12-10T22:58:37Z,2024-12-10T22:58:37Z
@KarenKennedy-lq8nt,"You are a hero.! To make this a racial thing,  it’s absurd.",0,2024-12-10T22:58:00Z,2024-12-10T22:58:00Z
@wingknutt1130,OMFG!  That opening clip was AWESOME!!!!!!,2,2024-12-10T22:56:51Z,2024-12-10T22:56:51Z
@markra4044,It's the job of the media to deliver Luigi's message!!,3,2024-12-10T22:56:45Z,2024-12-10T22:56:45Z
@adelaeder6290,"Your intro to this show is shameful. It looks like it shows that there has been a shooting of one of either Kamala Harris or Joe Biden. Why do you have to do this? I am a republican, but this one I really don’t condone. It’s too much what goes around comes around. Don’t gloat things change. From now on, I’m skipping your show .",0,2024-12-10T22:55:28Z,2024-12-10T22:55:28Z
@jeannienickel7,This Canadian thx you for love for John Candy… also your hope for Canada encourages us. 🥰,4,2024-12-10T22:54:06Z,2024-12-10T22:54:06Z
@1221dom,"Nope, the new intro music still sticks",1,2024-12-10T22:47:42Z,2024-12-10T22:47:42Z
@allisonsmith3583,NOPE IM A CONSERVATIVE REPUBLICAN GOOD JOB LUIGI DONT LISTEN TO THESE TALKI G PUPPETS,0,2024-12-10T22:44:18Z,2024-12-10T22:44:18Z
@jmatt4life,"What is the Neely dad talking about?
His son was a mentally unstable, career criminal, enabled by lack of parenting and an unjust legal system which permitted his barbarism.
This is George Floyd 3.0+.
Quite obviously, the family is trying to profit off the son’s unfortunate ending, a death which he chose.
The Liberal Left is fanning the flames of this racially/politically motivated bonfire.
The current administration has allowed our home grown TERRORISTS to pillage, maim, and kill without accountability.
What about the daily black on black crime?
Where are the protests for that?
There are enough B-O-B crimes to riot and pillage every day.
This all is about opportunity and potential profit for the Homeland Terrorists playing victims and the MSM shooting for views/ratings which aid and abet the Lefty Democrats and leads to their complicit revenue.
The Liberal Left is an entwined spider web of corruption and deceit which needs to be dismantled, thoroughly cleaned out and refurbished, including cooperative, guilty Republicans!
America needs a reboot for a better future, a future!",0,2024-12-10T22:44:09Z,2024-12-10T22:44:09Z
@FeelinFroggyFinds,He can’t have sex because of his back but can surf and work out? Seems shady,0,2024-12-10T22:42:50Z,2024-12-10T22:42:50Z
@jmatt4life,"Courage is not the absence of fear, it’s how you handle fear.
Kudos to Daniel Penny for handling his fear and saving lives which were threatened.",38,2024-12-10T22:38:16Z,2024-12-10T22:38:16Z
@silverfox2086,"As a nearly 67YO black man, I suggest that whites not allow riotous blacks to get away with destroying property. I lived through the '68 King riots in the Lawndale neighborhood of Chicago. It was terrifying for my mother to see our stores and support services burned to a crisp.  In her quiet way, she never quite got over it.",1,2024-12-10T22:35:13Z,2024-12-10T22:35:13Z
@annieD67,God Leftists are so rude and yappy!,0,2024-12-10T22:34:24Z,2024-12-10T22:34:24Z
@annieD67,The TorStar is a joke.  A completely biased Liberal rag.  You rock Dave! ❤,0,2024-12-10T22:33:25Z,2024-12-10T22:33:25Z
@WilliamMacDougall-vz7io,Also Penny should be free...so good!,1,2024-12-10T22:32:29Z,2024-12-10T22:32:29Z
@guyturner5368,"The UHC CEO assassin worked to the point where he looked great with his shirt off, surfed in Hawaii, and had a debilitating back condition?  What am I missing??",2,2024-12-10T22:31:10Z,2024-12-10T22:31:10Z
@douglaslemaire6190,It's a shame that we have to explain this to people?,0,2024-12-10T22:27:19Z,2024-12-10T22:27:19Z
@CurtGRAFF-q4y,Not Navy...  USMC,0,2024-12-10T22:24:33Z,2024-12-10T22:24:33Z
@gimenovax1,The Toronto Red Star is a communist paper.,0,2024-12-10T22:16:52Z,2024-12-10T22:16:52Z
@MattyMatt80,"As a lifelong born and raised New York resident living in the lower upstate area about an hour north of Manhattan I used to be quite frequent traveling to New York City and down on the subway and I too as a Caucasian man would sometimes encounter similar to the situation such as the ones that unfortunately took place That lied to the death of this man.  The bottom line is the United States needs a serious rebuild on the mental health factor that has seriously took her huge downfall and has been ignored for years, which has been proven such by the actions that I’ve occurred lately by all the chaos and outburst of people acting out without any actual reason just to get attention and that is very unfortunate. Both stories that were in this video could’ve been prevented I think with some serious mental health frequent towards these gentlemen.
I Miss The America I Grew Up In. But that said Governor Kathy Hochul needs to be impeached immediately for her ridiculous rants and calls for violence is absolutely ridiculous!
Apparently, common sense there’s no longer comment anymore. 
Piers Morgan is excellent at what he does. Just as much as you Dave Rubin and Megyn Kelly and other incredible independent journalists who are actually doing the journalistic work that once used to exist in America, which has no longer I think anymore now it’s just a opinion media attention grabber, which is absolutely BS!
We need to bring common sense back to America Again!",2,2024-12-10T22:11:40Z,2024-12-10T22:11:40Z
@Rhonda2580,"Someone should tell those government workers whose jobs are at risk that, if they want to keep their jobs, they should be prepared to prove that they are important to the operation and mission of the agency that they work for.  Or are they just another unnecessary cog in the wheel?  I think that is entirely reasonable.  That is what any company does when it runs into hard financial challenges and is faced with cutting staff.",1,2024-12-10T22:08:31Z,2024-12-10T22:08:31Z
@jeannienickel7,Thx Dave…. Loving my 1775 coffee 😎,1,2024-12-10T22:08:28Z,2024-12-10T22:08:28Z
@nuqwestr,"Dave,  interview Gen Wesley Clark, he was on Piers Morgan calling Israel ""Palestine"".",0,2024-12-10T22:07:15Z,2024-12-10T22:07:15Z
@nuqwestr,"NATO member Turkey just turned the Hagia Sophia church into a Mosque again, There are CIA trained operatives backed by Jordan inside the Free Syrian Army in the South along with perhaps a dozen other rebel groups yet to be heard from. This is like Libya, Algeria, even Egypt. Pan-Arabism is dead, and it appears the Ottoman Empire just finally won WW1.",0,2024-12-10T22:05:42Z,2024-12-10T22:05:42Z
@tmaas1349,"Top 5 not in any particular order: Stripes, Planes Trains and Automobiles, Cool Runnings, Space Balls, Home Alone",0,2024-12-10T22:04:29Z,2024-12-10T22:04:29Z
@climacus7118,Is Scott Jennings the most tolerant person in the world ? Sitting with a quiet demeanor with this bunch of hysterical and obnoxious lefties trying to interrupt every word he utters.,2,2024-12-10T22:03:04Z,2024-12-10T22:03:27Z
@anthonyscully2998,John candy was Canadian?,3,2024-12-10T22:01:42Z,2024-12-10T22:01:42Z
,"Sadly, Rumble has digressed, over time.",0,2024-12-10T22:00:12Z,2024-12-10T22:00:12Z
@alfredo2712,"Oh the irony...
The left when it comes to Penny: no one has the right to take someone's life!
The left when it comes to the CEO: good, he was killed!
Can't make this stuff up......",1,2024-12-10T22:00:08Z,2024-12-10T22:00:08Z
@janmorton6729,"Dave, you deserve a front row seat at Trump's press briefings.",2,2024-12-10T21:59:29Z,2024-12-10T21:59:29Z
@nikobenjamin3018,😂😂😂,0,2024-12-10T21:58:09Z,2024-12-10T21:58:09Z
@donnapadula1658,Where was father and family all these years he’s on the street !  Please it’s about the money 💴,1,2024-12-10T21:57:50Z,2024-12-10T21:57:50Z
@Flashhood1425,"I don’t condone his murder, but calling Brian Thompson “innocent” is pretty rich. The founding of the this country was a violent uprising against the powers that oppressed the average person… I don’t condone it, but I get it.",11,2024-12-10T21:53:25Z,2024-12-10T21:53:25Z
@katied8238,"What I got from what Dave said, he hurt his back surfing in Hawaii.  How could Mangione ride a bus for all those hours with a bad back?  The other situation - Why didn't Neely's family do something to help him.  Every time, this seems to be the way it goes.",8,2024-12-10T21:45:49Z,2024-12-10T21:49:07Z
@gregorypozzo5693,"Nobody ever mentions Harry Crumb. Who's Harry Crumb is John Candy's funniest movie, full stop. Trust me, I'm Canadian. 😆",0,2024-12-10T21:44:49Z,2024-12-10T21:44:49Z
@georgegrace5778,"Rand Paul is the poster boy of, 'calmly just explaining the truth.'",7,2024-12-10T21:44:23Z,2024-12-10T21:44:23Z
@gregthebaritone,"""Please welcome the President of the United States and First Lady, Jill Biden.""

Sounds like they introduced her as one and the same.",0,2024-12-10T21:42:40Z,2024-12-10T21:42:40Z
@pointshealthcoaching8474,It shows how n y c takes care of its mentally ill homeless citizens not at all,1,2024-12-10T21:41:35Z,2024-12-10T21:41:35Z
@richtravis9562,summer rental isn't in his top 5. sorry.,0,2024-12-10T21:40:23Z,2024-12-10T21:40:23Z
@AbigailA470,"Dave! The reason it is acceptable is because situational ethics has led to social justice. Social justice is not just, it’s perverted justice. They celebrate the death of the CEO the same way they do if Trump were assassinated. They view it as JUSTIFIED which is why they’re not embarrassed, they are righteous (they believe) in their anger",1,2024-12-10T21:38:38Z,2024-12-10T21:38:38Z
@stang93ful,I feel for his father no doubt about it and my prayers go out to him even though he didn’t give a shit about his son his entire life but I’m not a hateful soul so I’ll pray for him. Having said that for these pathetic sorry ass clowns in BLM around him calling for chaos and a rigged system and what are we gonna do about it? Give me a fkn break. That fraud ass organization only cares about money. They PROVED EXACTLY THAT when they STOLE AND FUNNELED MILLIONS into their OWN ACCOUNTS while not doing a fkn thing for any person of color so GTFOH with these full of shit people and their bullshit. Nobody cares about em anymore. THEY ARE FRAUDS!!!,1,2024-12-10T21:36:26Z,2024-12-10T21:36:26Z
@staloki,"Honor , courage, & commitment",2,2024-12-10T21:35:20Z,2024-12-10T21:35:20Z
@RogerJanisse,Has anyone on the left ever considered we have Obama to thank for our current health care system. It seems his everyone must have health care funds exactly what they are bitching about,8,2024-12-10T21:34:57Z,2024-12-10T21:34:57Z
@shelliallibhai2114,Suburban mom here in Toronto and I adore you Dave Rubin. ❤🎉🇨🇦 just watched a John Candy movie 🎬  with the kids 😂,1,2024-12-10T21:26:36Z,2024-12-10T21:26:36Z
@phantombunny,who are they framing a mario brother? now that's super mario brothers with rabies and italian gangster power.,0,2024-12-10T21:26:27Z,2024-12-10T21:26:27Z
@phantombunny,I love Canada especially the maple syrup,0,2024-12-10T21:25:21Z,2024-12-10T21:25:21Z
@kruzanJFD,The sound level is low?,0,2024-12-10T21:24:34Z,2024-12-10T21:24:34Z
@Flashhood1425,"I don’t condone his murder, but calling Brian Thompson “innocent” is pretty rich",1,2024-12-10T21:21:36Z,2024-12-10T21:21:36Z
@sanangelo7926,If you write a manifesto that’s a sign your crazy.,0,2024-12-10T21:17:51Z,2024-12-10T21:17:51Z
@reviewaccount469,"Work out a deal with all our allies to offer the Syrian Christians asylum in our countries(not just the US), but no involvement militarily.",1,2024-12-10T21:17:39Z,2024-12-10T21:19:07Z
@harleigh5262,"No one wanted Jordan to die, but he was threatening others. Granted, We don't know their full family history, but if you say you cared about your son, why was he homeless, not living with you getting mental care that he apparently needed question mark?",8,2024-12-10T21:17:02Z,2024-12-10T21:17:02Z
@johnbaker6125,One thing that Islamists hate worse than Christians and Jews are the Druze and about 50% of them are in Syria.,0,2024-12-10T21:16:44Z,2024-12-10T21:16:44Z
@SuperSpikejack,Oh Canada,0,2024-12-10T21:15:55Z,2024-12-10T21:15:55Z
@carlossantillan4647,"Also, I believe Daniel Pennt was a Veteran of the US Marine Corps.",0,2024-12-10T21:14:25Z,2024-12-10T21:14:25Z
@edetcetera,"I mentioned in your last podcast about free trade with Canada, but I guess you don't read the comments. Canada is not ripping off the USA with trade deficits. The USA has 10 times the population of Canada which mean Canada is going to use 10 time fewer/less products and produce then the USA. so what looks like a deficit is actually a just ratio without creating a glut or shortage.",0,2024-12-10T21:14:19Z,2024-12-10T21:14:19Z
@CoffeeDrinker-fs1co,Eugene Levy (americsn pie) is also from 2nd city comedy in Canada,0,2024-12-10T21:14:17Z,2024-12-10T21:14:17Z
@janmorton6729,Why is Scott Jennings on CNN?  He deserves so much better than those evil idiots!,0,2024-12-10T21:13:21Z,2024-12-10T21:13:21Z
@Sweetheart-TRY,Hahaha oh my. To be honest Dave I like your podcast best out of Megyn and daily wire and Candace etc. from 🇨🇦 ❤,0,2024-12-10T21:12:44Z,2024-12-10T21:12:44Z
@carlossantillan4647,CORRECTION!!  Daniel Penny DID NOT CHOKE the subway nutcase.  This is why he was acquitted.  All he did was hold the guy down until the NYPD waddled into the scene!,13,2024-12-10T21:09:04Z,2024-12-10T21:09:04Z
@crystalkeara8868,This is how the Nazi was created and people gladly called in their neighbors to have them taken away and k/lled. This woman is completely brainwashed. As much as I hate the insurance companies I don’t want them dead. That’s effing crazy,0,2024-12-10T21:05:49Z,2024-12-10T21:05:49Z
@yehoshuabenavraham9706,Scott Jennings can barely get a single one of his very sane sentences out without someone talking over him.,5,2024-12-10T21:03:04Z,2024-12-10T21:03:04Z
@Freedom-Fries,I never saw Jon Stewart as an instigator until now. So disappointing to see his radical side show through.,1,2024-12-10T21:02:24Z,2024-12-10T21:02:24Z
@scottmcee,"100% - NOPE. Sorry Dave, this is NOT your best work. Your extended rant about how we shouldn't take justice into our own hands...100% true, but a 100% TOTALLY missing the MOST IMPORTANT point. The system is broken, we know it, doctors know it, hospitals know it, and it is making people suffer and it is killing people. If we don't fix it, we're going to keep pushing unstable people in a bad direction. A system that works is absolutely critical to a stable society and keeping mentally unstable people from doing bad things.",0,2024-12-10T20:59:51Z,2024-12-10T20:59:51Z
@harleigh5262,Summer Rental has always been my favorite JC movie!,0,2024-12-10T20:59:51Z,2024-12-10T20:59:51Z
@dominiccounts4023,One person woke up in the morning without any intention of killing or harming another person.  The other individual woke up with a plan to assassinate another human being.  How can CNN conflate the two men!,0,2024-12-10T20:56:05Z,2024-12-10T20:56:05Z
@ColinMacIver,Not to mention the defunding of psychiatric wards all over North America.,0,2024-12-10T20:52:12Z,2024-12-10T20:52:12Z
@alextolledi8139,"Pay no attention to the ""Toronto Star"", no self respecting Canadian does, and there's a reason why we in Canada call it the ""Toronto Communist Star"".",0,2024-12-10T20:50:40Z,2024-12-10T20:50:40Z
@davidbaldwin9830,The removal of Assad weakens Iran and Russia. This is a good thing overall.  The new regime in in Syria is in contact with the Israelis.  We need to wait and see.,0,2024-12-10T20:50:30Z,2024-12-10T20:50:30Z
@Mark_Demaline,How much was the check b l m cut the old man?,0,2024-12-10T20:49:16Z,2024-12-10T20:49:16Z
@ptaalman100,"Most Canadians no longer read the Toronto Star. It went so left years ago it lost all respect.  Without money from Justin Trudeau $148,000 a week, it would have gone under in 2021. Only citiots - city idiots - read their shite.",0,2024-12-10T20:48:13Z,2024-12-10T20:48:13Z
@Michael-go6rl,Johnny LaRue…😂,0,2024-12-10T20:47:56Z,2024-12-10T20:47:56Z
@wjason,Of course they are going to spotlight the far right fellows. They are allot more attractive than the far left.,0,2024-12-10T20:46:19Z,2024-12-10T20:46:19Z
@Michael-go6rl,"You’re right of course Dave, vigilantism should never be acceptable. In a civilized society governed by the rules of law, there’s an expectation that violent criminals will be jailed and corporate leaders will be held accountable. When the justice system no longer meets these expectations, the rise of Paul Kersey type vigilantes is inevitable.",1,2024-12-10T20:44:40Z,2024-12-10T20:44:40Z
@lightinthedarkness753,The intro was THE BEST!  It sure caught me by surprise 😳,3,2024-12-10T20:43:22Z,2024-12-10T20:43:22Z
@joehoover5204,They could have a debate between Kamala and Jill. There might be enough intellect to light a light bulb.,0,2024-12-10T20:41:52Z,2024-12-10T20:41:52Z
@davinasampson6557,Thank you Dave another great show as always.,1,2024-12-10T20:38:59Z,2024-12-10T20:38:59Z
@joehoover5204,"The Epstein list covers a lot of power people. That is never coming out, just like the Kennedy assassination papers!",0,2024-12-10T20:38:44Z,2024-12-10T20:38:44Z
@mjfxd,a limitng back problem that still allowed him to surf?,1,2024-12-10T20:37:54Z,2024-12-10T20:38:13Z
@leahhanderson3737,"1:00:42 My 96 year old Grandmother worked for the government in DC in the 60s and 70s. She said there were people  in her office left work, didn't show, and were never held accountable. Apparently its been going on for decades. At this point its part of the culture of Washington.",6,2024-12-10T20:37:16Z,2024-12-10T20:37:16Z
@fkuhn7437,Stop giving air time to evil people. That's just click bait,0,2024-12-10T20:37:14Z,2024-12-10T20:37:14Z
@danielmenza4571,His father misses him?  Where was he his entire life?  Where was he when he was arrested 42 times?  He left him his entire life.  BLM is a joke.  They stole your money and purchased mansions.   Neely was out of his mind threatening people's lives.  He was high and out of control.  Defend him?  What a joke!,1,2024-12-10T20:35:30Z,2024-12-10T20:35:30Z
@joehoover5204,"When it comes to healthcare, we do not have a functioning society. You pay into healthcare at exorbitant rates both private insurance and Medicare/Medicaid. When the time comes when you need care, insurance does not cover whatever it is. This Murder is a GIANT red flag that something needs to be done NOW! Not hopefully sometime for somebody! The point is the American people are in the middle, paying the bill for NOTHING, while Congress gets kickbacks from healthcare providers, insurance companies, and big pharma!",0,2024-12-10T20:34:55Z,2024-12-10T20:34:55Z
@oliveoil7642,"The Toronto Star has been known for  a very long time as The Red Star. Marxist jibberish, anti police and funded through taxpayers money for the LPC!",0,2024-12-10T20:34:43Z,2024-12-10T20:34:43Z
@SallySioux,"John Candy in the movie 🎬 
""Uncle Buck.""",0,2024-12-10T20:34:33Z,2024-12-10T20:34:52Z
@cajunroadwarrior,We have a very serious problem of insurance companies denying coverage abusively to increase profits.,1,2024-12-10T20:32:41Z,2024-12-10T20:32:41Z
@kimburke3189,I really do not understand why this is a right or left issue. You have a guy who determined life or in most cases death for thousands or hundreds of thousands of people. He ruined lives financially! I wouldn't say he deserved to die but  I understand why people have no sympathy. It has nothing to do with left and right!,1,2024-12-10T20:30:46Z,2024-12-10T20:30:46Z
@bobd4062,"I wonder what that protestor behind the microphone would do if he, and his family, were on the subway when some guys strated  threatening to kill him and his family?",1,2024-12-10T20:28:22Z,2024-12-10T20:28:22Z
@SallySioux,"I have a question.
Q. Do you think the fact that the CEO was to talk about 'Insider Trading' could be one of the reasons the man was shot?
Q. Yes or No?",1,2024-12-10T20:27:04Z,2024-12-10T20:30:51Z
@williamreichold1545,More proof just how deranged the Left of 2024-25 is.,1,2024-12-10T20:26:22Z,2024-12-10T20:26:22Z
@_Keith_,I didn't get the intro.  Was it supposed to be like a fake cartoon fight between Sleepy Joe & Kacklin' Kamala?,0,2024-12-10T20:25:59Z,2024-12-10T20:25:59Z
