User,Comment,Likes,Published At,Time Ago
@madcausesadandbad,"Luigi did the most American possible thing. Trying to demonize him in favor of Daniel Penny, who also did the most American possible thing, is a total non starter.",0,2024-12-20T04:45:05Z,2024-12-20T04:45:05Z
@TheInsomniaddict,"Dave, I'm shocked you didn't mention Canadian Bacon, a literal documentary on how Canada can be weaponized against the United States!",0,2024-12-17T23:56:29Z,2024-12-17T23:56:29Z
@Tikvah99,"@DAVERUBIN - Can I make a request that when you're showing external clips, you drop the volume down a shade - I listen via earbuds & sometimes have almost had my ears blown from the higher volume - esp with people shouting or rioting etc.  Thanks!",0,2024-12-16T22:38:23Z,2024-12-16T22:38:23Z
@jeremyfields1704,Rubin shit bro.. please please change that into song bro. That is the worst intro of all time.,0,2024-12-15T14:22:42Z,2024-12-15T14:22:42Z
@tjsho417,Said CEO isn’t an “innocent man” you bootlicker.,0,2024-12-15T13:11:25Z,2024-12-15T13:11:25Z
@AmydeWolf,"My stance on Syria.

Agree the US shouldn't play a role in deciding who leads, BUT the US does need to cautiously talk with them to ensure US interests in the region are protected.

We need to leave the troops where they are as we don't want to give up our world positions. China can easily come in and hold that position instead, which weakens our stance against that region even further.",0,2024-12-14T07:53:13Z,2024-12-14T07:53:13Z
@phubble1877,"Suspected/alledged killer, innocent until proven guilty.",0,2024-12-14T04:34:03Z,2024-12-14T04:34:03Z
@olligesd9343,"@ 19:20, His father and that other rabble rouser BOTH said ""lets do something about this"". AFTER the court case has been completed. What are you going to do ""about it"" when this case has been through BOTH law enforcement and judicial processes? get violent?",0,2024-12-13T15:38:49Z,2024-12-13T15:38:49Z
@anthonybeasley7076,"""Likely"" to be watching you on a computer or a phone? Wouldn't that pretty much be CERTAINLY??",0,2024-12-13T10:42:47Z,2024-12-13T10:42:47Z
@mandalorianactual1215,"You really will not convince the majority of people that this CEO is innocent. When you make money profiting off of the suffering of millions of people and cause the deaths and bankruptcy of thousands, you are not a good person. And when you run a cartel, expect cartel things to be done to you. I have 0 sympathy.",1,2024-12-13T02:11:15Z,2024-12-13T02:11:15Z
@scottstewart8737,"So the guy can work out and get jacked, but he can’t have intimate relationships? What?",0,2024-12-12T22:53:10Z,2024-12-12T22:53:10Z
@ianrock4402,"""we have a legal system for this very reason"", we have the second amendment for this very reason bud. How are individuals supposed to litigate against the largest companies in the world? You're out of touch",1,2024-12-12T22:34:48Z,2024-12-12T22:34:48Z
@nancyg.8616,"Favorite John Candy movie: Planes, Trains and Automobiles",0,2024-12-12T20:09:35Z,2024-12-12T20:09:35Z
@DavidWilliams-cm4ow,Maybe Luigi is an FBI asset.,0,2024-12-12T18:36:05Z,2024-12-12T18:36:05Z
@annebaugh2835,"The left cheers an assassin who takes out an insurance CEO, and demonizes RFKJr who wants to revamp our healthcare systems legally,  make it make sense!",1,2024-12-12T17:27:47Z,2024-12-12T17:27:47Z
@annemcguire5995,Hysterical intro,0,2024-12-12T16:38:15Z,2024-12-12T16:38:15Z
@karenbraughton3179,The father should be calling for doing something about mental health,0,2024-12-12T16:30:45Z,2024-12-12T16:30:45Z
@karenbraughton3179,Pelosi’s in on this . Check out her smear tactic speech,0,2024-12-12T16:07:56Z,2024-12-12T16:07:56Z
@soonerjane8966,if Whoopi's viewpoint is correct - then mentally ill people should wear a sign that says so.  How did Daniel Penny or any of the other men that held him down as he screamed violence & threatened EVERYONE in the subway car know that he was mentally ill?,1,2024-12-12T15:59:52Z,2024-12-12T15:59:52Z
@TheGreatSatan_,"That father acting like he's affected, lol. He put him through the foster system because he's another absent father",0,2024-12-12T15:38:00Z,2024-12-12T15:38:00Z
@aleece4,"It seems like everyone is ignoring the fact the Daniel Penny didn’t kill that man! The coroner said he died from other causes (drugs, I think) and NOT Daniel’s actions.",0,2024-12-12T14:07:00Z,2024-12-12T14:07:00Z
@JAMAICADOCK,"These lame strawmen arguments are not going to work for much longer, Trump supporters are laughing along with Stewart too. 

The age of culture war tit-for-tats is gonna give way to serious issues that affect millions upon millions of people and not just a bunch of passengers on a subway",0,2024-12-12T13:35:44Z,2024-12-12T13:37:22Z
@erinbsullivan444,"I think they’re both heroes! Seriously though, how did Luigi grow a unibrow in a few days?!?🤨",0,2024-12-12T12:25:18Z,2024-12-12T12:25:18Z
@jeanieshafer9714,These Dems love to racialize everything & twist the truth to fit THEIR narrative  agenda.  It's just sick...an illness. Satan loves it.,0,2024-12-12T12:14:07Z,2024-12-12T12:14:07Z
@mikeydoodle143,Omg BLM wants another looting to get free stuff again 😢😢,0,2024-12-12T10:58:23Z,2024-12-12T10:58:23Z
@deeannakim9306,"You can’t change the corrupt system that sets and  controls the rules, laws, and regulations. The corrupt system can’t be changed by corrupt system. The lobbyist aka legal bribers have total control over politicians. Citizens absolutely have no say, no control, or ability to change this corrupt set up.",0,2024-12-12T03:31:42Z,2024-12-12T03:33:50Z
@deeannakim9306,"I had never seen the country so united over rotten and corrupt health insurances. 🥹❤️ good luck finding the jury of 12 who will convict. They would have to have rich, disconnected, and entitled to get the conviction.",0,2024-12-12T03:29:49Z,2024-12-12T03:29:49Z
@ericholmes4152,"Where were Neely’s backers before - he was homeless, on drugs and attacking people on a subway.  They should have to pay Pennys legal fees!!!",0,2024-12-12T02:36:28Z,2024-12-12T02:36:28Z
@ericholmes4152,What makes these so-called journalists think they might not be the next one on his list????,0,2024-12-12T02:30:40Z,2024-12-12T02:30:40Z
@jenniferlamia3001,"My lort, man.  Drink some water!  Lol😅",0,2024-12-12T02:26:20Z,2024-12-12T02:26:20Z
@dansbike1,That was a funny joke...,0,2024-12-11T22:22:38Z,2024-12-11T22:22:38Z
@CampsitePyro,"21:02 also, how about be quiet? because when you are loud, it is really annoying to people of all races. All eardrums matter.",0,2024-12-11T22:02:02Z,2024-12-11T22:02:02Z
@jonslagill8864,Why do people have to interrupt when they are giving an answer on CNN.,0,2024-12-11T21:59:28Z,2024-12-11T21:59:28Z
@Itsjustme115,The left are terrorists when they are armed!,0,2024-12-11T21:43:24Z,2024-12-11T21:43:24Z
@michaela.6698,CNN is an embarrassment and an unwatchable propaganda outlet for the insane left.,0,2024-12-11T20:58:16Z,2024-12-11T20:58:16Z
@ladyjade6446,Canada is run by cartels. Dairy. Wheat. Drugs now.,0,2024-12-11T19:23:39Z,2024-12-11T19:23:39Z
@lainedelfelder4283,🤚🏼🤚🏼🤚🏼. I know what they can do!  Fathers can quit abandoning their children!,0,2024-12-11T19:12:53Z,2024-12-11T19:12:53Z
@chrisijams6153,"Isn’t the assassin’s college U Pen, the same institution that the Biden Center is affiliated with? The location for massive Chinese money laundering? Wouldn’t it also make sense, that possibly other manipulations took place at U Pen where stand out students might find themselves unwittingly involved with or by nefarious actors through indoctrination? It just seems that many other paths of fighting the system, would be apparent to a well educated, outgoing student, over brutally assassinating one man, and throwing the brilliant start, in light of some challenges, of your life away. What kinds of scholarships did Luigi receive along the way? While most are generous philanthropic donations, some come with conditions, or unique focus requirements to fulfill, that could alter an individual’s path. Obviously much more to learn here on both sides of the tragedy.",0,2024-12-11T18:37:11Z,2024-12-11T18:37:11Z
@melissag.664,"It was 200+ words, NOT pages. If you read the manifesto, you'll know he didn't write it. He starts off thanking the feds for the great work they do in this country?! Yeah, sounds legit.",0,2024-12-11T18:35:10Z,2024-12-11T18:35:10Z
@melissag.664,"Read the ""manifesto."" It's clear he did NOT write that.",0,2024-12-11T18:24:48Z,2024-12-11T18:24:48Z
@YourXLNerd,"lol, this intro music is something else.",0,2024-12-11T18:12:42Z,2024-12-11T18:12:42Z
@BellaMarsilioRN,"PALLETS OF CA$H SHOW UP IN GOVERNMENT BUILDINGS IN DAMASCUS SYRIA

The pallets were marked with a QR code. And that QR code led to none other than the federal reserve bank of New York.  Crazy!",0,2024-12-11T18:06:40Z,2024-12-11T18:06:40Z
@melissag.664,Where was Jordan Neely's father when he was arrested 42 times before..?,0,2024-12-11T17:49:55Z,2024-12-11T17:49:55Z
@peterquinlan4095,"blacks are a protected class. unaccountable for any and all actions 'cause they're black.nobody, including hiis family gave two figs for jordan neely-until they could monetize his death.",0,2024-12-11T17:28:57Z,2024-12-11T17:28:57Z
@LizzyM2024,"Why don't they help someone like the man that died ""threatening other people""?  instead they will threaten other people , do something GOOD FOR ONCE!!!!!   Trouble makers !!!!!!!  What did they do to help Jordan Neely while he lived ?  NOTHING!!!!!",0,2024-12-11T17:21:09Z,2024-12-11T17:21:09Z
@LizzyM2024,I think these people should of cared about this man before he died and HELPED him then !!!!!!  Why didn't they do something then ????,0,2024-12-11T17:17:08Z,2024-12-11T17:17:08Z
@BPEntertainment1,I have a chronic back condition. My doctor won't do anything for me so I just quite going. I would never end her life over it,0,2024-12-11T17:16:15Z,2024-12-11T17:16:15Z
@LizzyM2024,"That's why I don't watch regular media anymore , liars , bias etc.",0,2024-12-11T17:02:24Z,2024-12-11T17:02:24Z
@LizzyM2024,Love your reporting Dave Rubin !,0,2024-12-11T16:56:09Z,2024-12-11T16:56:09Z
@nataliameimarismd3292,Benny Johnson did much better job on the subject,0,2024-12-11T16:46:12Z,2024-12-11T16:46:12Z
@nataliameimarismd3292,Dave this is the first time I’m listening to your report and it sounds like mainstream media. You’re manipulating facts and taking soundbites. I hope it’s just the lack of research.,0,2024-12-11T16:45:52Z,2024-12-11T16:45:52Z
@nataliameimarismd3292,Dave this is the first time I’m listening to your report and it sounds like mainstream media. You’re manipulating facts and taking soundbites. I hope it’s just the lack of research.,0,2024-12-11T16:45:22Z,2024-12-11T16:45:22Z
@LeanneAnderson-eo4ck,Good thing they found him. It sounds like that C.E.O. was the first of others……if he had a manifest listing others….,0,2024-12-11T16:44:07Z,2024-12-11T16:44:07Z
@nataliameimarismd3292,"Don’t call Mangione bad till we know the truth, this case is very strange",0,2024-12-11T16:39:22Z,2024-12-11T16:39:22Z
@shivakrishnarama,"White collar stiffs like Rubin shouldn't be doing commentary on the healthcare industry in general, the dichotomy of care between the Have's and Have Not's is too much for wealthy entitled people to understand.",0,2024-12-11T16:29:42Z,2024-12-11T16:29:42Z
@fireflipper3195,"Why isn’t the medical examiner held responsible for all of this?  If he was alive when Penny released him, how could he have died from the choke hold?  That doesn’t make sense!",0,2024-12-11T16:28:39Z,2024-12-11T16:28:39Z
@kennethvankley7089,Sounds like the dad is calling for people to riot but just doesn't know how to incite the crowd.,0,2024-12-11T16:26:56Z,2024-12-11T16:26:56Z
@Jes052960,20:37 - My question is: Why didn’t his dad step up and raise him when he should have. His father was the first brick in the road that brought his son to that final conclusion. No wonder why his son ended up so messed up on the street. I feel sad for his son to have had to live such a terrible life of abandonment. Blaming others for problems created by oneself does not solve the problem.,0,2024-12-11T16:24:46Z,2024-12-11T16:24:46Z
@gailc3042,"Luigi could work out, surf, but couldn't have sex?   I call bull",0,2024-12-11T16:23:02Z,2024-12-11T16:23:02Z
@kimbowen5552,Maybe the reason some progressives believe it's intentionally a hate crime to accidentally have someone die while protecting others is because they believe it's ok to assassinate someone you disagree with and therefore hate.,0,2024-12-11T16:22:39Z,2024-12-11T16:22:39Z
@Salazarsbizzar,I'm friends with ppl on the right and left who think both guys are heroes 😂. If you think Luigi is a bad guy then your an establishment hack. Einstein 😂😮😂,1,2024-12-11T16:13:10Z,2024-12-11T16:13:10Z
@diandragomez6208,"These are the same people that tell Christians ""You're judging my life, don't judge!!"" but act like judge and jury and think killing an innocent man on the street is fine, Hypocrites!!",0,2024-12-11T15:52:11Z,2024-12-11T15:52:11Z
@ginabisaillon2894,The basic principle of all insurance is that you are betting that they will pay and they are betting that they will not pay!,0,2024-12-11T15:42:19Z,2024-12-11T15:42:19Z
@elizabethphilly2011,Pleasuring yourself on a subway - not only in New York. I was riding Broad Street line subway in Philadelphia - and witnessed exactly that. Almost threw up! No law and order in Dem running cities,0,2024-12-11T15:39:39Z,2024-12-11T15:39:39Z
@robertroetter5317,"Maybe when governments fail to protect, its good that people like Penny are around. Should have been no trial and the idiots that brought this to trial shoud not be public servants.",0,2024-12-11T15:35:27Z,2024-12-11T15:35:27Z
@ginabisaillon2894,We used to have that kind of situation in Canada where the insurance denied payment. But now with our healthcare system everybody and everything is covered. Yet you Americans hate our system. I'm a conservative so don't accuse me of being a leftist please! It's just that sometimes someone is too close to the forest to see the trees. And some Canadians complain about not having a family doctor yet they can still see a doctor. Look I'm not saying our system is perfect but it's the closest thing and I knew what it was before cause I'm 83 years old. I wouldn't go back.,0,2024-12-11T15:35:20Z,2024-12-11T15:35:20Z
@Courier_Eris,They're trying to make this penny situation the next Floyd,0,2024-12-11T15:33:29Z,2024-12-11T15:33:29Z
@rachaelmccarl,"Man, love John Candy.",0,2024-12-11T15:26:11Z,2024-12-11T15:26:11Z
@macpduff2119,Stop stop saying Luigi is guilty. I believe that the police do not have the right guy.,0,2024-12-11T15:17:46Z,2024-12-11T15:17:46Z
@SeeTheTravisty,"After watching my mother fight with her insurance company while fighting cancer , losing a lung and almost dying..

There is no argument I will hear that insurance execs are “innocent people”

Not even a valid statement",0,2024-12-11T15:13:03Z,2024-12-11T15:13:03Z
@j.l.mcdonald9997,Isn't Penny a Marine?,0,2024-12-11T15:04:21Z,2024-12-11T15:04:21Z
@Sheeesh310,Finally Justice was served for Daniel P!… I’m sick of the race card wielding and the kids family tryin’a capitalise off the system… villains claiming victomhood smh 🙄,0,2024-12-11T14:43:59Z,2024-12-11T14:46:33Z
@motor2of7,"Hochul, Bragg, Adams, they all need to go.",0,2024-12-11T14:43:02Z,2024-12-11T14:43:02Z
@Dan-cn6zp,B L M  🤡 🤡🤡,0,2024-12-11T14:33:09Z,2024-12-11T14:33:09Z
@SarahHollywood-t1i,If you have ever had a loved one in the hospital desperately needing care but you have to argue with an insurance company to get it then you will understand why I have no empathy at all for the ceo,0,2024-12-11T14:12:57Z,2024-12-11T14:12:57Z
@Livefree6922,"I work in healthcare, and UHC is the worst. They deny so much, 30% denials, and hospitals/ clincs have to write off a lot. The insurance companies have no right to tell doctors how to care for their patients.",0,2024-12-11T14:05:44Z,2024-12-11T14:05:44Z
@melissap8925,Daniel Penny should file suit against the city for malicious prosecution. This seems like a clear cut case. He could also make a civil rights case that he was discriminated against based on his race of being WHITE because a black man was in this same situation on the subway and stabbed someone in defense of self and others and no charge was filed there!! Whats the difference? Race.,0,2024-12-11T13:56:53Z,2024-12-11T13:56:53Z
@melissap8925,Daniel Penny should file suit against the city for malicious prosecution. This seems like a clear cut case. He could also make a civil rights case that he was discriminated against based on his race of being WHITE because a black man was in this same situation on the subway and stabbed someone in defense of self and others and no charge was filed there!! Whats the difference? Race.,0,2024-12-11T13:55:58Z,2024-12-11T13:55:58Z
@kellymcgowan3547,Kathy Hochul is wrong on EVERYTHING!,0,2024-12-11T13:43:05Z,2024-12-11T13:43:05Z
@caliberspecificreload,19:58 - Jordan Neely's father all of a sudden misses his son? I wonder who paid him to say that? 🙄 what a liar.,0,2024-12-11T13:31:54Z,2024-12-11T13:31:54Z
@liamlynch2115,There are several videos of crazy people being violent on public transportation. This guy wasn’t some kid asking for food. That day he was threatening people’s lives.,0,2024-12-11T13:30:14Z,2024-12-11T13:30:14Z
@liamlynch2115,There are endless weirdos in YT comments celebrating Luigi. Crazy.,0,2024-12-11T13:21:51Z,2024-12-11T13:21:51Z
@usarebel420,"father of the homeless drug addict says ""what are we gonna do?"".... WHY NOT RAISE YOUR CHILDREN?",0,2024-12-11T13:21:19Z,2024-12-11T13:21:19Z
@feegureeetout,I wonder how may self defense claimed will make to u.s. courts during the year?  And how many does the media care about?,0,2024-12-11T13:13:46Z,2024-12-11T13:13:46Z
@gamingbigfats3934,You have many fans in 🇨🇦!,0,2024-12-11T13:10:26Z,2024-12-11T13:10:26Z
@hawkwellhead,"If someone finds 'Joy' or a lack of empathy with the murder of a healthcare CEO is 
 deserved then would they think that the murder of ANY CEO in ANY business that the far Left deems to be against their twisted ideology is also justified?",0,2024-12-11T13:09:27Z,2024-12-11T13:09:27Z
@joedaigle7398,Stop insulting the man Dave! He was in the Marine Corps!😂😂,0,2024-12-11T13:02:51Z,2024-12-11T13:02:51Z
@paulapolis6710,people are stupid,0,2024-12-11T12:49:45Z,2024-12-11T12:49:45Z
@paulapolis6710,so that's stupid because if u really cared about your son why was he homeless,0,2024-12-11T12:45:56Z,2024-12-11T12:45:56Z
@pyromanaic21,Why was penny the only one charged. Others were helping by holding him down,0,2024-12-11T12:44:26Z,2024-12-11T12:44:26Z
@tonybrown8706,Nice! I love Summer rental!,0,2024-12-11T12:11:17Z,2024-12-11T12:11:17Z
@Lizardo451,The reason we're policing the world is that the alternative is awful.,0,2024-12-11T12:11:03Z,2024-12-11T12:11:03Z
@SethBergile,If the subway story would have been a black on black or white on white crime….. we never would’ve heard about it. The media is fueling the race war!,0,2024-12-11T12:09:21Z,2024-12-11T12:09:21Z
,"Call me crazy. IMO, Penny AND Mangione are both heroes in their own ways. Penny potentially saved innocent lives on that subway. Mangione potentially saved (as of yet unknown) lives because he shed light on the darkness that is the health insurance scam in America. Only time will tell if Mangione's crime will result in any reform of the corrupt, evil, health insurance scam. OBTW, BLM is a TERRORIST organization. All of them must be charged, prosecuted and incarcerated.",0,2024-12-11T12:08:52Z,2024-12-11T12:16:10Z
@stephenbell8349,How much did he care about his son who was a homeless addict?,0,2024-12-11T12:04:41Z,2024-12-11T12:04:41Z
@Lizardo451,We can ignore the world but the world may not ignore us.   In Syria our allies are the Kurds.  Will we protect the Christians?,0,2024-12-11T12:02:07Z,2024-12-11T12:02:07Z
@JennyBotelho-j5o,In the court room the blm leader turned to Daniel penny and threatened him in court in front of the judge it is completely wild that he gave him a death threat said it’s a small town or something a small city basically that he’ll find him and they did nothing. It’s so disgusting.,0,2024-12-11T12:01:06Z,2024-12-11T12:01:06Z
@bleukettu4521,"When I used to work loss prevention we had a shoplifter punch someone in the face and I took him to the ground. In the scuffle he got a cut on his head, after punching me several times. Man drug me to court for ""assault"". The judge took a glance at the case and dismissed it, but this world is crazy.",0,2024-12-11T11:43:19Z,2024-12-11T11:43:19Z
@igloo2158,"That opening is hilarious. I’m all for AI, lol.",0,2024-12-11T11:36:12Z,2024-12-11T11:36:12Z
@Rick48757,He's not a innocent man,0,2024-12-11T11:26:17Z,2024-12-11T11:26:17Z
@blondinevloggt,i see two people who both acted to defend other people's lives and unfortunately had to take someone's life in the process. they are both heroes. conservatives and leftists are both acting silly on this.,0,2024-12-11T10:56:36Z,2024-12-11T10:56:36Z
@joscreemers4360,How have we allowed young people to become so desensitised to murder? Is this a failing of parents? Do we need to look at video games? Is it the education system? I'm 60 and I cannot believe what I'm hearing and seeing by some of these people,0,2024-12-11T10:45:32Z,2024-12-11T10:45:32Z
@sageakporherhe783,"19:00 how is the system rigged, bro? Your son was threatening to kill passengers, if he succeded, I'm sure you'd have come on here to say that he is a good person and was just having a bad day and doesn't deserve to go to jail because he is a sweet boy. I understand that you are sad, but this is just not the way to go about it, your son was prevented from killing people, mourn your loss and move on with your life.",0,2024-12-11T10:36:54Z,2024-12-11T10:36:54Z
@sageakporherhe783,"Imagine saving a bunch of people from dying, but people want you to go to jail for that.",1,2024-12-11T10:33:09Z,2024-12-11T10:33:09Z
@jonathanhunter5323,"Planes, Trains, and Automobiles!! ""You're going the wrong way!!!""",0,2024-12-11T10:30:16Z,2024-12-11T10:30:16Z
@sharongallagher3443,Miley did not withdraw our troops in Syria as he told him to do when Trump was President. A treasonous act  done by Miley  by not withdrawing the troops...,0,2024-12-11T10:17:14Z,2024-12-11T10:17:14Z
@sageakporherhe783,Holyshit! That intro scared me. 🤣,0,2024-12-11T10:16:30Z,2024-12-11T10:16:30Z
@ads13924,American healthcare system needs to be sorted out. Business is business but you shouldnt be making billions on the back of denying healthcare. Disgusting system. If anything it should just cost what it really costs. Without costs being ludicrous. Surgical procedures should cost the time of the surgeon (not gluttonous salary) the nurses and the others involved. What I can see by the costs in America is that the government dont care. And that needs adressing,0,2024-12-11T10:10:33Z,2024-12-11T10:10:33Z
@sharongallagher3443,The level of that insurance exec. does not decide  individual coverage decisions.,0,2024-12-11T10:07:06Z,2024-12-11T10:07:06Z
@sharongallagher3443,With a centerist president coming into office will help change this viewpoint.,0,2024-12-11T10:01:09Z,2024-12-11T10:01:09Z
@sharongallagher3443,Insider trading like Nancy Pelosi does daily.,0,2024-12-11T09:45:45Z,2024-12-11T09:45:45Z
@sharongallagher3443,These news people have not learned anything about clean news broadcasting.,0,2024-12-11T09:44:57Z,2024-12-11T09:44:57Z
@WJFK480,"That guy, Neely had a huge arrest record and was convicted of punching an elderly woman and breaking her nose.",0,2024-12-11T09:41:20Z,2024-12-11T09:41:20Z
@sharongallagher3443,Too bad Neiily's father never was around to help him because he has severe problems.,0,2024-12-11T09:37:27Z,2024-12-11T09:37:27Z
@alexshevchenko7568,"I wonder what would CNN, MSNBC and Co say if UnitedHealthcare CEO was a black person?",0,2024-12-11T09:34:25Z,2024-12-11T09:34:25Z
@sharongallagher3443,Self defense makes the difference with Mr  Penny. Kathy Hokel is a terrible mayor.,0,2024-12-11T09:31:50Z,2024-12-11T09:31:50Z
@frankfisher99,The Left are furious that they're not allowed to murder people,0,2024-12-11T09:31:02Z,2024-12-11T09:31:02Z
@anthraxcrab2222,Penny and Luigi are both heros,1,2024-12-11T09:21:28Z,2024-12-11T09:21:28Z
@sherrywright4557,"I heard that the CEO of United Health was supposed to testify against Nancy Pelosi about her insider trading, specifically about her 11.9 million from 1 trade she made before it went public that he knew she invested in with insider knowledge.",0,2024-12-11T07:52:47Z,2024-12-11T07:52:47Z
@cyn7869,"The blm grift is over.  No one cares about anything they have to say.  They were trying to grift another mansion out of this case but too bad, must suck to be you.",0,2024-12-11T07:36:28Z,2024-12-11T07:36:28Z
@jeremywilliams2898,"Hoekel is trash, Stewart's audience are trash, the mainstream media hosts defending Neely are trash, Neely's dad is trash. Society needs more people like Penny.",0,2024-12-11T07:35:36Z,2024-12-11T07:35:36Z
@SnapCracklePapa,Could someone please explain to me what that opening was all about? I'm very confused.,0,2024-12-11T07:31:37Z,2024-12-11T07:31:37Z
@sharonviksen788,Mr Neely lies and trying to cause chaos and get money. Why weren’t you the father he needed? He’s faking being sorry when he gave him up as a baby. He also looks homeless.,0,2024-12-11T07:12:19Z,2024-12-11T07:12:19Z
@davidgimmel6959,Penny innocent. you really need to look into how many people where denied heath care do to that CEO and died .then maybe you can be more objective. 😊,0,2024-12-11T06:56:40Z,2024-12-11T06:56:40Z
