User,Comment,Likes,Published At,Time Ago
@anael169,"I can guarantee you that there will be Russian actors found to have been leading or encouraging this all along.    They are trying to create an ""Arab spring"" situation in the US.",0,2021-01-06T22:09:00Z,2021-01-06T22:09:00Z
@ogilairval8003,We always have law enforcement officers present for black lives matters. Where are they today?,0,2021-01-06T22:08:56Z,2021-01-06T22:08:56Z
@kjguzman23,MAGATS getting called out on their own BS,0,2021-01-06T22:08:52Z,2021-01-06T22:08:52Z
@sandrasamuel9490,"Cop's only kill unarmed black ppls in America,",0,2021-01-06T22:08:52Z,2021-01-06T22:08:52Z
@smthone,It will take years and years to repair the damage done from tangerine Mussolini’s reign.,0,2021-01-06T22:08:51Z,2021-01-06T22:08:51Z
@timothygeorge2530,He is the spark,0,2021-01-06T22:08:49Z,2021-01-06T22:08:49Z
@chronicpainfighter5587,"They need to stay there, get the Cabinet together, WE MUST USE THE 25TH Amendment Vote RIGHT NOW to Remove Trump NOW because of this hideous behavior all because of Trump being so UNFIT, Swear Pence in for the rest of the term, and file charges against Trump at every angle now that you get ALL THESE People OUT 1st....Trump will not ever tell people to stop, we have a woman in critical cond, The Capital Police were overwhelmed. Who's going to pay for Trump's calling on his goons! He no better than a Head of a Mob, he's scared as hell, he's enticing a RIOT!!!  he's so afraid he''s finally caught or genuinely is CRAZY, either way, he has to go NOW!about his taxes, = Jail! Trump is INSANE, and UNFIT, as soon as we are safe Remove him!",0,2021-01-06T22:08:48Z,2021-01-06T22:08:48Z
@laurapottie8680,I hope all the dems and GOP in the capitol  approached Cruz and said thanks for putting my life in danger,0,2021-01-06T22:08:45Z,2021-01-06T22:08:45Z
@davidfreyn6917,I just had a relative who is a trump supporter say that its not trump supporters its the left causing problems at the capital... These people have lost their mind.,0,2021-01-06T22:08:44Z,2021-01-06T22:08:44Z
@Thunder_Paul,Trumpist terrorists at it again. Dismantle the Republican party immediately.,0,2021-01-06T22:08:41Z,2021-01-06T22:08:41Z
@bobmichael6296,If they can do this then they won't mind me killing half of them,0,2021-01-06T22:08:37Z,2021-01-06T22:08:37Z
@sandycheeks999,Cenk is shouting too much I can't take anything he says seriously. 💋,0,2021-01-06T22:08:37Z,2021-01-06T22:08:37Z
@timothygeorge2530,They would have loved him in Nazi germany,0,2021-01-06T22:08:30Z,2021-01-06T22:08:30Z
@leptonsoup337,I can´t wait to hear Jimmy Dore´s brilliant commentary.,0,2021-01-06T22:08:26Z,2021-01-06T22:08:26Z
@josephakwa7718,You elected a lunatic to the White House now you paying the price. Can't somebody? anybody? stop this Trump nonsense?,0,2021-01-06T22:08:22Z,2021-01-06T22:08:22Z
@eddieberrios5626,They think this is Russia or Korea or hitlers Germany ...  this is a dammm shame.   Thank you Donald trump.,0,2021-01-06T22:08:19Z,2021-01-06T22:08:19Z
@demekonrn,Their rage isn't unguided. Their leader has told them exactly what to do.,146,2021-01-06T22:08:16Z,2021-01-06T22:08:16Z
@mandeesman7889,Yeah you keep talking about what they are doing what are we bout to do because the cops ain't doing nothing to them it's going to get worse,0,2021-01-06T22:08:15Z,2021-01-06T22:08:15Z
@gust5992,"A Republican House member from Oklahoma on ABC news speaking to George Stephanopoulos: “I was there, I recognize these group of protesters are different. They are not President Trump’s supporters. I can tell, their eyes had the look of evil eyes on them”

Me: Really? Here is a soap Congresman, in case you needed to wash your filthy mouth!! 🙈🙈",0,2021-01-06T22:08:15Z,2021-01-06T22:08:15Z
@jaefrmbk2k,THE HYPOCRISY IS GLARING & RACIST & OH SO VERY WHITE AMERICAN 🇺🇸🇺🇸🇺🇸,0,2021-01-06T22:08:14Z,2021-01-06T22:08:14Z
@angelagosto2911,Universal Healthcare and Free College is a matter of national security!,3,2021-01-06T22:08:13Z,2021-01-06T22:08:13Z
@GabrielGoopar,"I used to admire USA, now I cannot help to call it Murica and laugh at it.",0,2021-01-06T22:08:11Z,2021-01-06T22:08:11Z
@Charbenaro,Is bernie ok?,0,2021-01-06T22:08:04Z,2021-01-06T22:08:04Z
@bobmichael6296,I'm heading down there right now and I'm going to start ending these racist,0,2021-01-06T22:07:52Z,2021-01-06T22:07:52Z
@MultiSkysthelimit,The 70 million MAGA Republican are whipped up by Fox News everyday.,0,2021-01-06T22:07:48Z,2021-01-06T22:07:48Z
@clytchan,Everything was eerily calm right after the election. That was the “calm before the storm.” You had to know Trump supporters weren’t going to tuck their tails between their legs and accept defeat. They were talking about what they were going to do months before the election if Trump lost. It really shouldn’t come as a surprise to anyone. I can only imagine what other countries are thinking about America right now.,0,2021-01-06T22:07:42Z,2021-01-06T22:07:42Z
@denden8326,Trump is a thug and believe he is above the law. Hes behaving like rusea and north korea dictator. People should be ashamed to say they are republican. Nobody can say anything bad about jamaica bcuz we are the best compare the lawlessness happening in usa,0,2021-01-06T22:07:36Z,2021-01-06T22:07:36Z
@wallywalpamur4951,Hopefully this will inspire Biden to go all out and fry tRump and his pathetic followers.,0,2021-01-06T22:07:36Z,2021-01-06T22:07:36Z
@jakecobelton9876,Gimme mooneeeeeyyyyyyy,0,2021-01-06T22:07:32Z,2021-01-06T22:07:32Z
@anomalyentity850,"The U.S. Capital was NOT secured/guarded????
The county court houses are more secured than a maximum security prison.
The whole thing was staged.  They were let in.
Police and state troopers are barely starting to show up just now?  Think about it people.",0,2021-01-06T22:07:31Z,2021-01-06T22:07:31Z
@miansahib9590,"trump should be locked up and tried for treason for Inciting Armed Revolt against the executive branch , in an attempt to oust a duely elected president",0,2021-01-06T22:07:26Z,2021-01-06T22:07:26Z
@youknowcrimedontpay9257,I predicted this. My Trump following Koolaid drinking friend refuses to talk to me. I predicted the Biden victory and the Trump downfall. I also predicted everyone would be pardoned by Trump although they were al guilty as charged. Pence regrets what he has done but don't be fooled if Trump won he be hugging the US flag.  Complete fools who are now turning on each other. Just like they the henchmen did to Saddam.,0,2021-01-06T22:07:24Z,2021-01-06T22:07:24Z
@francesconoce3056,What strikes me is that EVERYONE knew that all these terrorists where going to the Capitol and there was almost NO security . They could just walk in . Crazy crazy shit...,0,2021-01-06T22:07:22Z,2021-01-06T22:07:22Z
@kevinknight9728,Yeah security shot a pro Trump supporter. A woman,0,2021-01-06T22:07:21Z,2021-01-06T22:07:21Z
@jeezymay,"They had that place locked down with the mere thought of the BLM group...but these guys, meh...

If that doesn't bring to light the obscene racial bias I don't what will.

The very thought of fraud is incited by an undercurrent of anger for black people exercising their right to vote.

_""The presidency was stolen!""_",1,2021-01-06T22:07:20Z,2021-01-06T22:07:20Z
@nieselpriem,"I love Cenk. He's such a passionate guy. But I've never seen him so outraged,and that scares me. Greetings from Germany by the way.",12,2021-01-06T22:07:17Z,2021-01-06T22:07:17Z
@themessenger3216,"Change is coming. These letters were written for 330 million people. They were not written for 18th century society. They would help about now. What they expose is extremely progressive. They have a foundation in science thanks to Benjamin Franklin. There are over 700 of them. I'm in the final stages of editing a 250,000 word volume that illustrates about 75. The USA is where it is at today because it was founded on an alternative fact. Benjamin Franklin wanted to invent a better society. He was the singular ""creator"" of the U.S. Constitution. He had to find a way to get the sub-subcultures of slavery to find purchase in it for ratification. He knew they would read what they wanted too. He had help in this. 18th century society didn't read the fine print of just one sentence. They read the easiest sales pitch in human history being the perception of a gift of power. A literal algebraic equation in plain sight that requires no interpretation. The deplorables will always be their but I suspect the ""middle"" will shift about 10 points to the left. Most will still want to be patriots. A thing learned can be un-learned if truth is to have any say in the matter..


“History may distort truth, and will distort it for a time, by the superior efforts at justification of those who are conscious of needing it most. Nor will the opening scenes of our present government be seen in their true aspect, until the letters of the day, now held in private hoards, shall be broken up and laid open to public view. What a treasure will be found in General Washington's cabinet, when it shall pass into the hands of as candid a friend to truth as he was himself!”

[Thomas Jefferson, To Justice William Johnson, June 12, 1823, Letter Founders Online MHI: Adams Paper]

Hope you don't mind me being so candid as surreal as this too me. This was stumbled onto after testing a hypothesis in a distinctly different manner with no expectation of discovery. I was compelled to investigate this further. If true.. it didn't belong to me. It would be rather useful about now. A constitutional tsunami that is about as blue as blue can be. It will horrify right wing ideology irrespective of nation.",0,2021-01-06T22:07:16Z,2021-01-06T22:07:16Z
@lmrmay244,They New this would happen cenk this is a practice run for the future Hoedown.,0,2021-01-06T22:07:15Z,2021-01-06T22:07:15Z
@mjsvloging7397,What I wanna know is whether or not they have pulled out the gas or rubber bullets and other weapons they pulled out for peaceful protesters,0,2021-01-06T22:07:14Z,2021-01-06T22:07:51Z
@francishooper9548,"The Russian spy masters must be amazed at how successful they have been manipulating Trump, O'Connell etc. and the Republican Party. An actual coup attempt - I doubt that they ever believed they could achieve this result.",0,2021-01-06T22:07:11Z,2021-01-06T22:07:11Z
@pulloutsange,Congress never blocks the national guard against black people. More proof that Congress supports Nazism.,0,2021-01-06T22:07:09Z,2021-01-06T22:07:09Z
@colinmaharaj,We need a device like a trump muzzle,0,2021-01-06T22:07:04Z,2021-01-06T22:07:04Z
@davidkeizer9381,They are some kind of special for sure!,0,2021-01-06T22:07:01Z,2021-01-06T22:07:01Z
@ozanvinb6825,"Are you surprised 🤨, he is doing his job, destroying your democracy for Russia 🇷🇺",112,2021-01-06T22:07:00Z,2021-01-06T22:07:00Z
@stephaniel4679,Pence should find the gd cabinet members...25th Amendment Now!....He literally should be charged with Treason,0,2021-01-06T22:06:58Z,2021-01-06T22:06:58Z
@mathewkelly9968,Shoot them shoot them all,1,2021-01-06T22:06:57Z,2021-01-06T22:06:57Z
@MegaToonzNetwork,"They want a trial....



BY KOMBAT!!!!!",0,2021-01-06T22:06:57Z,2021-01-06T22:06:57Z
@runsnaked9253,"Why were people not prepared for this,  including republicans?  tRump and his enablers including his children have been poking the bear for at least the past year.  Many posters here including myself could see this coming, an active coup a take over of the government in progress.  tRump should have rightfully been convicted in his impeachment trial in early 2020, if he were, we might not be in this situation now.",0,2021-01-06T22:06:46Z,2021-01-06T22:09:17Z
@stacyswoope7110,The rules don’t apply to some. So they think,0,2021-01-06T22:06:44Z,2021-01-06T22:06:44Z
@c.m.cordero1772,"But Antifa! BLM! Etc,etc.",1,2021-01-06T22:06:41Z,2021-01-06T22:06:41Z
@helenovecka5716,This is all on trump and his Republican colleagues.,1,2021-01-06T22:06:38Z,2021-01-06T22:06:38Z
@lindatisue733,"Durning 1991 USSR Coup, the reports were similar.  Bet Putin is smiling.",1,2021-01-06T22:06:38Z,2021-01-06T22:06:38Z
@pbdrawers,They will never arrest Trump. He needs to be taken out. Bang!!!!,1,2021-01-06T22:06:37Z,2021-01-06T22:06:37Z
@peterjasper575,ARE   YOU REALY REALY SURPRISED THIS IS HAPPENING         THIS IS AMERICA  LOL,0,2021-01-06T22:06:36Z,2021-01-06T22:06:36Z
@tylerking4576,Whys Cenk yelling it is really off putting,0,2021-01-06T22:06:36Z,2021-01-06T22:06:36Z
@carolewenman1308,"God, roll  on the  20th of this month.  Hopefully there will be dancing in the streets. The whole  world  will be there. There is an end but right  now  its a bit scary..",1,2021-01-06T22:06:34Z,2021-01-06T22:06:34Z
@jm15xy,Welcome to the Republic of Krakozhia.,0,2021-01-06T22:06:33Z,2021-01-06T22:07:17Z
@lungamasuku6872,"Sorry america!!,iam a south african and the last time i saw something close to this was 31years ago while we had Apartheid and the rightwing tryed to stop democracy!i pray and hope you guys get your democracy!,cause from where iam standing!,it looks like you guys live in a Apartheid State!,we pray for you!",0,2021-01-06T22:06:31Z,2021-01-06T22:06:31Z
@sandycheeks999,Protests Cenk doesn't like is a coup. Lol💋,0,2021-01-06T22:06:29Z,2021-01-06T22:06:29Z
@jogmas12,"The poleece just let them walk right on in. Police to a crazy right wing capital stormer: “who you looking for? Ok, he’s down two doors then left, good luck “.",0,2021-01-06T22:06:25Z,2021-01-06T22:11:35Z
@henrybyrd5402,It was worrying when the election was even close. The rest of the world cannot understand what has happened to America?,0,2021-01-06T22:06:25Z,2021-01-06T22:06:25Z
@robertodiaz9680,Cenk...you must remember...the Law & Order as deployed on the photo op at the nearby church are  reserved only for PACIFIC Protesters.,0,2021-01-06T22:06:23Z,2021-01-06T22:06:50Z
@kidofflint8812,They say the left are crazy these lunatics have have  officially   flew over the cuckoo‘s nest,4,2021-01-06T22:06:23Z,2021-01-06T22:06:23Z
@fighton5585,This is the start of an attempt at the new confederacy!!..js,0,2021-01-06T22:06:17Z,2021-01-06T22:06:17Z
@W3theDreamrz,"Is part of the Republican rhetoric trying to steal the election? Yes, but people also need to keep in mind it is more than that. It is being neglected and insulted with $600 relief checks. It is years of incrementalism and useless legislation giving handouts to the wealthy as we just saw it again multiple times under this administration. While I don’t advocate for violence, I will be very curious to see if this is a wake up call for representatives.",0,2021-01-06T22:06:15Z,2021-01-06T22:06:15Z
@colinmaharaj,"2021 we are off to a great start. Or, we are off.",0,2021-01-06T22:06:09Z,2021-01-06T22:06:09Z
@monicacarson4306,I just wonder what other countries are doing watching our joke of America right now.  And Police are taking selfies with these terrorists.,0,2021-01-06T22:06:09Z,2021-01-06T22:06:09Z
@kevinkey6771,Not a coupe it’s just a protest,0,2021-01-06T22:06:07Z,2021-01-06T22:06:07Z
@mariadeltorres4004,It's was bound to happen especially with way DONALD TRUMP J has been acting wait till JOE BIDEN TAKES Over it will be worse Donald Trump J Revenge it will worse for the Democrats his Voters will even try the most His hate is beyond in History. Hope they take better ways to Protect Joe Biden and all Democrat and Also Republican to they are in Danger from Donald Trump J and his crazy Voters his hate is to Great he lost control,0,2021-01-06T22:06:05Z,2021-01-06T22:06:05Z
@magicmarlie,America has fallen and I couldn't be more happier,0,2021-01-06T22:06:05Z,2021-01-06T22:06:05Z
@chanikynes4525,"The mad queen has sent her dragons to destroy Kings Landing. Jon Snow ? nowhere to be seen. Orange Queen downing a bucket of chicken wings ""I can´t have the throne, nobody can.""
This season finale s++++ a++.",3,2021-01-06T22:06:02Z,2021-01-06T22:06:02Z
@mysteryman9020,"When Trump wanted a photo op he had security mace peaceful protesters. When its his thugs, they can walk right onto the House Floor and take it over. This is treason. Trump should be arrested immediately before his people burn down the capitol.",0,2021-01-06T22:06:02Z,2021-01-06T22:06:02Z
@brianhenry7983,this is what mostly peaceful looks like.  notice no building burning down or shitty graffiti.  you expect notjing to happen after the media and deep state stole the election,0,2021-01-06T22:05:55Z,2021-01-06T22:05:55Z
@jpbaje,This was all planned when he put those goons in the Pentagon cuz they denied the national guard at first...also the police seem to have abandoned their post and then seen taking selfies with rioters...there should have been more prepared because they were signs beforehand,0,2021-01-06T22:05:54Z,2021-01-06T22:05:54Z
@delightfuldigs,Traitors,1,2021-01-06T22:05:54Z,2021-01-06T22:05:54Z
@anthonyjeanty3336,No arrests? No police violence? No enforcement of the law? It is obvious which race those things are reserved for.,84,2021-01-06T22:05:49Z,2021-01-06T22:05:49Z
@jeffjohnson5605,"Countless Americans upside down. I fear what's to come without cash relief or way better UBI. This violence is nothing compared to what could happen, bands of criminals could come to fruition",1,2021-01-06T22:05:42Z,2021-01-06T22:05:42Z
@patrickfair9107,I knew this was going to happen. The neo Confederacy made the first move now what are we going to do about it,0,2021-01-06T22:05:41Z,2021-01-06T22:05:41Z
@twitchfixer1344,Shameful America... Shame,0,2021-01-06T22:05:31Z,2021-01-06T22:05:31Z
@timothygeorge2530,Unfortunately they are becoming more powerful,0,2021-01-06T22:05:30Z,2021-01-06T22:05:30Z
@steveh721,"This insanity now was instigated by years of disinformation and outright Orwellian lies propagated by the Trump administration, Fox News, other right-wing information outlets, and, to some extent, corporate media.  

The Biden administration needs to resolve to charge McConnell, Trump and others with sedition, crimes against humanity, and reckless endangerment of Americans. 

Hold these seditionists accountable for their many destructive acts. If they aren't held accountable and sentenced appropriately for their various crimes, they'll believe they can get away with anything and try it again in our near future.

We're witnessing the end game of a Republican slow coup that was initiated circa 1980. As the coup was nearly complete before the 2020 elections, McConnell, Trump, et al will do anything in a desperate attempt to hold onto power to achieve a successful coup. The goal of the coup is to devolve our democratic republic to an oligarchic corporatocracy! 

This is sedition, and the seditionists have abdicated their oaths of office. They include right-wing Republicans (McConnell, other members of Congress, Trump, illegitimate members of the SCOTUS), some lobbyists and some corporate Democrats. By their actions, they have asserted their loyalty to ALEC, their corporate puppeteers (Kochs, Mercers, multinational corporations, et al), and establishing a corporatocracy, while undermining our social democratic republic and disregarding the needs of Americans at ANY cost. This includes the high cost of environmental destruction, of disregarding climate change. of wars for oil and profit, of social injustices, and much more.

Play hardball. Hold these seditionists accountable for their many destructive acts. 

The Biden administration needs to charge McConnell, Trump and others with sedition, crimes against humanity, and reckless endangerment of Americans. Furthermore, the Biden administration could encourage the International Court of Justice (ICJ) to charge McConnell and Trump with crimes against humanity, and consequently be tried by the ICJ.",0,2021-01-06T22:05:28Z,2021-01-06T22:05:28Z
@ednabehnke5869,You can never ever make silk out of a sows  ear.,0,2021-01-06T22:05:27Z,2021-01-06T22:05:27Z
@hannamakela6989,"I think I have to eat a mouthful of humble pie and admit I was wrong when I thought Pence was even worse than Trump. I am not a fan of Pence and never will be, but at least he is not part of THIS insanity.",0,2021-01-06T22:05:19Z,2021-01-06T22:05:19Z
@carmene626,Most of the comments on the right wing sites are beyond insane! They’re claiming it’s left wing and antifa dressed as them to make them look bad 🤦🏻‍♀️,0,2021-01-06T22:05:12Z,2021-01-06T22:05:12Z
@maritzablue5543,Where are the arrest. Double standard police. They make it so obvious.,297,2021-01-06T22:05:08Z,2021-01-06T22:05:31Z
@generalsixty2133,SHITHOLE !,0,2021-01-06T22:05:06Z,2021-01-06T22:05:06Z
@neamia3,I thought the librals were the violent ppl,0,2021-01-06T22:05:05Z,2021-01-06T22:05:05Z
@sandrasamuel9490,"This is call white privilege, when BLM PROTEST, police was all over the street killing blm ppls.",1,2021-01-06T22:05:00Z,2021-01-06T22:07:09Z
@miansahib9590,"republican party should be banned and outlawed since the people have come out very nakedly as rascist, and fasicts. All of it's members barred from ever practicing politics in the USA.",0,2021-01-06T22:04:55Z,2021-01-06T22:04:55Z
@sharonwolfe4230,Trump needs to be charged with inciting. He's gone too far.,73,2021-01-06T22:04:54Z,2021-01-06T22:04:54Z
@the_konami_kid,This day will be trumps b.s. legacy.,0,2021-01-06T22:04:54Z,2021-01-06T22:04:54Z
@PlayingMantis,the right wing thinks the entirety of the constitution is held in the 2nd amendment. the rest is optional.,0,2021-01-06T22:04:49Z,2021-01-06T22:04:49Z
@robashton8606,"As an outsider looking in, this is absolutely horrifying. I can only imagine what it must be like for you guys. This is truly how civil wars begin. I _sincerely_ hope that sanity prevails, but you seem to have seventy four million people for whom the sanity ship sailed some four years ago.
 Best wishes from the UK. Good luck.",1,2021-01-06T22:04:41Z,2021-01-06T22:06:02Z
@ORGANICsoulJAZZ,6:43 Banana (🍌🐘)Republican lol,1,2021-01-06T22:04:40Z,2021-01-06T22:04:40Z
@timothygeorge2530,They  cant read,0,2021-01-06T22:04:33Z,2021-01-06T22:04:33Z
@sandycheeks999,Cenk trying to stop another movement.🇺🇸🇺🇸🇺🇸🇺🇸,0,2021-01-06T22:04:21Z,2021-01-06T22:04:21Z
@marklewis9594,Patriots at work,0,2021-01-06T22:04:18Z,2021-01-06T22:04:18Z
@markjackson2000,And I bet they all go to church and believe in an almighty how did a country breed so may s***kickers,0,2021-01-06T22:04:18Z,2021-01-06T22:04:18Z
@bonnsbee1527,Virginia  is sending in their guard,0,2021-01-06T22:04:17Z,2021-01-06T22:04:17Z
@pbg9208,it was BLM disguised as fat white nazis,0,2021-01-06T22:04:13Z,2021-01-06T22:04:13Z
@Maureen_Schilder,this was all pre-planned  - wouldn't surprise me if  TYT was given a heads up from some Clintonite,0,2021-01-06T22:04:13Z,2021-01-06T22:04:13Z
@tippinlewis9113,Wow that's crazy inside the Capitol,0,2021-01-06T22:04:12Z,2021-01-06T22:04:12Z
@trooperricky2944,If it was BLM that said they were going to protest they would have the national guards there two weeks ago lol. This is just crazy 😜,118,2021-01-06T22:04:10Z,2021-01-06T22:04:10Z
@DavidNelsoncsc,"Bring in SWAT, they want to die for their Jesus, let them fulfill their fantasy.

This isn't a protest, they are not a militia. They are seditionists and traitors. The ones who survive, investigate and prosecute for their high crimes with blind justice regardless of wealth and power, and execute justice as our laws in place dictate.",0,2021-01-06T22:04:10Z,2021-01-06T22:04:10Z
@dianabaker7919,"I listen to you all a lot
 Thank you I. Can't believe what I am seeing in my 62 years I have. Never seem this in my life. And I have served my country this is not what I want. PEACE IS WHAT WE NEED GOD BLESS US ALL!!!! THANKS TO YOU ALL. GREAT JOB TO EVERYONE ON YOUR SHOW YOU AND ANNA!!!",0,2021-01-06T22:04:09Z,2021-01-06T22:04:09Z
@derekmulling745,There traitors should be shot on site!!!,0,2021-01-06T22:04:09Z,2021-01-06T22:04:09Z
@marioguti9887,"From someone in Mexico, never have I thought I would see something like this in the US, this happens in Latin America but not the US...sad day.",4,2021-01-06T22:04:07Z,2021-01-06T22:04:07Z
@frankiewhitmore2306,Lock his Ass up Seriously!! Cruz .. Hawley All them Should Go too jail Smfh Trump put the Building in harms way and Got a Women Shot and People injured Smh This is a damn disgrace,0,2021-01-06T22:04:05Z,2021-01-06T22:04:05Z
@Mike500912,Yet another super-spreader event !!!,0,2021-01-06T22:03:59Z,2021-01-06T22:03:59Z
@mandeesman7889,It's not unbelievable to me y'all let stupidity breathe,0,2021-01-06T22:03:57Z,2021-01-06T22:03:57Z
@thomashartman1998,"This is barefaced treason! These people must  be tried, convicted and sentenced to life in prison. This cannot and must not be tolerated. The perpetrators must be hunted down and destroyed.",19,2021-01-06T22:03:56Z,2021-01-06T22:09:12Z
@dliv1687,FREE ALL POLITICAL PRISONERS!!!!,0,2021-01-06T22:03:56Z,2021-01-06T22:03:56Z
@sunshine-wb7gr,🤣🤣🤣 they have to turn on each other,0,2021-01-06T22:03:54Z,2021-01-06T22:03:54Z
@timothygeorge2530,Supporters too,0,2021-01-06T22:03:52Z,2021-01-06T22:03:52Z
@AegisEpoch,"Those who are fortunate enough to be surrounded by individuals who love and respect you and those of you who had your needs met and didnt have to reach into unsafe places for assurance, these pillars of security made you an unsavory target to certain folks you may not be aware of who would do you harm. but congratulations! We've all just met and experienced the conclusion to the chaotic and dangerous nature of having to associate with a narcissist. the lies, the gaslighting, the unaccountability, the flying monkeys, all of it.",0,2021-01-06T22:03:51Z,2021-01-06T22:03:51Z
@sandycheeks999,C.I.A talking points calls it a coup.,0,2021-01-06T22:03:50Z,2021-01-06T22:03:50Z
@jcdemp7513,They say that about the left. About hating the constitution.,0,2021-01-06T22:03:45Z,2021-01-06T22:03:45Z
