User,Comment,Likes,Published At,Time Ago
@TheShocker650,You are the definition of a clown.,0,2024-08-08T21:30:59Z,2024-08-08T21:30:59Z
@daveadam435,This is what happens when you're government weaponize ya justice department !,0,2024-06-22T16:18:53Z,2024-06-22T16:18:53Z
@thomastackett2577,"The Right wing has always wanted authoritarian rule.  Look back in history, evrn before George Washington was elected President. Becore Jefferson fundamentally wrote the Constitution (yes, i know ithers were involved but it was primarily Jefferson) the Right wing and southern states wanted auhoritarian rule after we fought a war to rid ourselves of them. Jefferson and Franklin would be ashamed of the right wing fascists.",2,2024-02-14T08:05:30Z,2024-02-14T08:05:30Z
@adamjoshuahughes3971,"Man......From do wm here in Aotearoa NZ.....I still can't even.....
I mean yeah America has been a shit show since the get go, but still.

And yeah we've got our own silent coup attempt happening right now with our own newly elected far right Govt wanting to ""Revisit our founding documents - the principles of Tiriti O Waitangi (The Treaty of Waitangi). between the Indigenous Māori and the Crown"".
Not to mention the rest of our own shit show atm",0,2024-01-07T07:55:26Z,2024-01-07T07:55:26Z
@sullytarawene1762,I was watching live 👀 from Aotearoa/New Zealand 🇳🇿 couldn't believe what I was witnessing.,1,2024-01-05T23:24:40Z,2024-01-05T23:24:40Z
@gemcan54,"NAZI PELOSI HELPED PLAN THE RIOTS WITH RAY EPPS ON JAN 6TH.  BOTH ARE MURDERERS OF ASHLI BABBIT.   NOW THE JAN 6TH CORRUPT PANEL WANTS TO CONVENIENTLY DESTROY THE EVIDENCE.

TCCLARIEN.  
RAY EPPS FINALLY GOT SENTENCED FOR HIS JAN 6TH ACTION, UNFORTUNATELY ONLY ONE YEAR PROBATION.   HE WAS YELLING ""GO TO THE CAPITOL"", AND YET THE LYING DNC MEDIA AND JOKER JACK SMITH SAID TRUMP INCITED PROTESTERS.  PELOSI NOW ADMITS SHE COULD HAVE DONE MORE TO SECURE THE CAPITOL.",0,2023-08-13T04:45:58Z,2024-10-04T04:41:05Z
@Kenny-tc6rg,This hasn't aged well 🤣🤣🤣 tyt is 🐎💩,1,2023-03-11T16:33:43Z,2023-03-11T16:33:43Z
@TRAN305,JAN 6 FAKE LIBERAL BULLS#*+,0,2023-03-08T04:21:03Z,2023-03-08T04:21:03Z
@taintedgooch,This is as fake as it gets,0,2023-03-08T00:42:07Z,2023-03-08T00:42:07Z
@thysdebeer2911,I love you so much right now.,0,2022-12-18T10:02:24Z,2022-12-18T10:02:24Z
@tigzhalas,The military are missing from protect our representatives and senators,0,2022-10-05T14:51:44Z,2022-10-05T14:51:44Z
@ViLLagE-BiCycle269,LIES,0,2022-09-24T20:00:28Z,2022-09-24T20:00:28Z
@matthewaylward3552,Definitely a coup,0,2022-07-16T03:44:49Z,2022-07-16T03:44:49Z
@Calbeck,"So it turned out the ""shots fired"" were police killing an unarmed woman, the VP was never ""in hiding"", and nothing happened but trespassing. Aren't you the people who actually defended psychos burning down police precincts, by the by?",1,2022-04-08T19:48:55Z,2022-04-08T19:48:55Z
@alojr35,I just voted for Biden cause I wanted trump out anything is better than him.,1,2022-02-05T21:20:20Z,2022-02-05T21:20:20Z
@alojr35,I get it republicans are bums I just learned something.,0,2022-02-05T21:18:38Z,2022-02-05T21:18:38Z
@88badstang,Couldn't find anything from TYT on the 2011 Wisconsin capital insurrection by Democrats. Wonder why that is.,2,2021-08-16T12:24:49Z,2021-08-16T12:24:49Z
@pamlewis1183,Is America Great Again yet? Dangerous f*****g man and his Natzi minons,0,2021-07-09T04:35:41Z,2021-07-09T04:35:41Z
@thealienwatcher540,You were so right Cenk everything you predicted came True,0,2021-07-03T16:29:39Z,2021-07-03T16:29:39Z
@goblinstrategist301,So where's the demanded change by progressives? :(,0,2021-06-25T02:38:51Z,2021-06-25T02:38:51Z
@New-mp1cg,I can't believe this was only 5 months ago,1,2021-06-06T22:15:58Z,2021-06-06T22:15:58Z
@57andstillkicking,Conservatives are not traitors. A tiny segment did this because they thought the election had been stolen. The majority of thousands of people at the rally were totally peaceful. You are always generalizing in ways that are inaccurate. You are like a child in that.,0,2021-05-27T02:06:02Z,2021-05-27T02:10:13Z
@rosenia5409,"After learning what happened during the insurrection, there was chaos and inequality and injustice. We will learn from this and come back stronger than ever.  Thanks TYT! Ya are amazing and such great people, much love!",4,2021-05-25T11:13:19Z,2021-05-25T11:13:19Z
@daniquitter8963,Hillary clinton called them what they are,0,2021-04-21T15:26:57Z,2021-04-21T15:26:57Z
@HotspurFC-cu6ny,Never in a million years did I think a coup would happen in the United States,0,2021-03-12T05:27:19Z,2021-03-12T05:27:19Z
@MrMatterice,in 2016 cenk wanted to do away with the electorial collage. hawo abat dat,0,2021-02-14T17:54:00Z,2021-02-14T17:54:00Z
@nathansearls9972,So right about so many wrong things. Keep it up.,0,2021-02-12T17:14:59Z,2021-02-12T17:14:59Z
@ferko6,Wow you're you got more in you then my kids diaper.,0,2021-02-10T03:15:14Z,2021-02-10T03:15:14Z
@harmetheis988,If there's one thing that comes out of this I hope your channel goes down for somebody that says it's okay to go sleep with a teenager and I've got the video to prove it you said it,0,2021-02-08T01:39:03Z,2021-02-08T01:39:03Z
@Verykawaiiyoucantrelate,Lol waiting for update if the story,0,2021-02-06T20:26:16Z,2021-02-06T20:26:16Z
@bhmcrumbs1348,"Donald Trump has taken a page from Putin's play book, & opened the floodgate of LIES & MANIPULATIONS into this country & spread it like the coronavirus.
His minions & armies of ruthless liars & manipulators in factions of the government, ex-government, military, ex-military, police force, ex-police force, regular wannabe citizens quickly followed suit & organized nationwide to turn the rule of law & order into force by guns, violence & verbal & physical intimidations.  UNDER 45th PRESIDENT OF THE UNITED STATES FROM 2017 TO 2021 DONALD TRUMP, ALL HELL HAS BROKEN  LOOSE.",0,2021-01-31T14:25:45Z,2021-01-31T14:25:45Z
@jeanellis6793,? Peace 😊,0,2021-01-22T23:49:00Z,2021-01-22T23:49:00Z
@Blubirdmoon111,The PROBLEM is that dems always overestimate the consequences for Repubs.,1,2021-01-18T06:23:10Z,2021-01-18T06:23:28Z
@Blubirdmoon111,"No cenk, Repubs will always win no matter what they do.",1,2021-01-18T06:22:15Z,2021-01-18T06:22:15Z
@truthliesopinions4591,45 Impeached yayyyyyy 🎉🎊🎊🎉🎈🎊,0,2021-01-13T21:25:05Z,2021-01-13T21:25:05Z
@edwardcudeyro5113,It’s time to unite the country and heal all you do is run your mouth and make gossip you’re not helping the situation you’re really not.,0,2021-01-11T22:35:32Z,2021-01-11T22:35:32Z
@edwardcudeyro5113,Donald Trump had the best stock market ever prior to corona Donald Trump had the lowest unemployment Donald Trump squared up with China Donald Trump help the veterans with pro-choice Donald Trump in education he’s done so many things you are really stupid and you’re really ugly person because you have Hayton you need to go to church and confess your sins and for your soul.,0,2021-01-11T22:32:38Z,2021-01-11T22:32:38Z
@edwardcudeyro5113,Joe Biden is a gun grabber he’s trying to grab AR 14s which they never made he’s also trying to change all the gun laws that’s very unconstitutional why don’t you practice what you preach.,0,2021-01-11T22:29:13Z,2021-01-11T22:29:13Z
@edwardcudeyro5113,Why don’t you use your platform for something more positive I never hear about you and your friends doing charities helping people uniting Americans all you do is badmouth Donald Trump it’s getting old he’s on his way out and he’s leaving who are you going to pick on next you really need to look in the mirror and look at yourself because you’re very ugly the things that you and your people talk about.,0,2021-01-11T22:26:27Z,2021-01-11T22:26:27Z
@MarquisVegan,Im getting Cenks book.,0,2021-01-11T18:17:42Z,2021-01-11T18:17:42Z
@alexburt6995,These guys are going to prison for sooooooooo long! They might get out just in time to witness the inauguration of the 56th president! 👮‍♂️👮‍♂️👮‍♂️,0,2021-01-11T02:34:40Z,2021-01-11T02:34:40Z
@willtripp5062,Rip Ashli Babbitt,0,2021-01-11T00:44:25Z,2021-01-11T00:44:25Z
@ViveLeEmpereur,"One thing I've learned over the past few years is that when something seems so incompetent it's unbelievable, it is usually by design. Some of the Capitol Police were 100% in on this conspiracy and supported it.",0,2021-01-10T21:21:14Z,2021-01-10T21:21:14Z
@Lazy4kGamer,"Police let them walk in??? umm cenk, do you remember C*H*A*D ???? Lol or CHAZ??",0,2021-01-10T05:01:34Z,2021-01-12T17:55:24Z
@terribletomvu37,How dare Pence seek safety from a mob?,0,2021-01-09T21:25:34Z,2021-01-09T21:25:34Z
@cnnnpc4351,this is what the democrats encouraged for four years now they want to wipe their hands clean. remember maxine waters and ayanna pressley's calls for harassment and violence.,1,2021-01-09T18:04:56Z,2021-01-09T18:04:56Z
@louismart,Is it really unbelievable? We all could have known.Don’t think you are on the safe side after President Biden has been sworn in. You have a significant part of your voters that do not back democracy!,0,2021-01-09T17:11:09Z,2021-01-09T17:11:09Z
@Anon-qp3kt,Where were the right wing patriots with guns that were supposed to fight against these terrorists?,0,2021-01-09T11:15:07Z,2021-01-09T11:15:07Z
@reginalram9050,"Even Putin is saying ""damn this lunatic is outta control""",2,2021-01-09T10:56:06Z,2021-01-09T10:56:06Z
@ChargerBullet,There is nothing worse than a conservative.,0,2021-01-09T05:56:16Z,2021-01-09T05:56:16Z
@ChargerBullet,"Never forget, never forgive that conservatives tried to turn these United States into a dictatorship.",0,2021-01-09T05:55:58Z,2021-01-09T05:55:58Z
@ChargerBullet,"No Trump, No KKK, No fascist USA",0,2021-01-09T05:55:11Z,2021-01-09T05:55:11Z
@ChargerBullet,"Once again, conservatives find themselves on the wrong side of history.",0,2021-01-09T05:54:42Z,2021-01-09T05:54:42Z
@ChargerBullet,Additional proof that conservatism is a mental disorder.,0,2021-01-09T05:54:24Z,2021-01-09T05:54:24Z
@WillEnAngel2008,Putin gave him the presidency!,0,2021-01-09T05:07:10Z,2021-01-09T05:07:10Z
@WillEnAngel2008,Coco Loco! Get him out of the WH. Disbarr Giuliani! He is a dangerous man.,0,2021-01-09T05:02:17Z,2021-01-09T05:02:17Z
@gregoryleggett9773,If Trump was in prison where he belongs this never would've happened.,2,2021-01-09T04:23:11Z,2021-01-09T04:23:11Z
@myway2653,You look mad,0,2021-01-09T04:19:25Z,2021-01-09T04:19:25Z
@rufusmedrano2962,The defense department offered help and was turned down is my belief. I read it. Gosh I wish I could remember,1,2021-01-09T03:38:01Z,2021-01-09T03:38:01Z
@ken45y,"Cenk, how is the goat??",0,2021-01-09T02:43:11Z,2021-01-09T02:43:11Z
@thegembezleeffect312,"Anything could have happened to those people (government officials). I heard they had zip ties, bombs, a noose for Pence. It would have been crazy if they had of gotten the job done. Where would we be.",0,2021-01-09T01:43:49Z,2021-01-09T01:43:49Z
@ricchildress8123,"Hey YOUNG TURDS , How come you didn't rush down and protect your Masters ?  After all you were paid a lot of money to support Pelosis view. Did she promise you could look in her refrigerator?",0,2021-01-09T00:44:44Z,2021-01-09T00:44:44Z
@davidjohnson927,"Hey Junk, oops, I mean jenk. How's it feel to be a sellout? Your show has become pathetic. Hope that $24 was worth it. Oh yeah, good job on sensationalizing this story. Do us all a favor. Take your money and go away.",0,2021-01-08T23:53:03Z,2021-01-08T23:53:03Z
@bjjb5059,BS,0,2021-01-08T23:26:01Z,2021-01-08T23:26:01Z
@Hulkenbreak,I want to know more about the defense dept refusing guard help. Can you do an episode on that as well?,0,2021-01-08T22:07:27Z,2021-01-08T22:07:27Z
@ShadowFoxSF,"Republicans on the whole didn't leave trump...
Some sane ones did change party...but I'm not aware in what amounts registration changed.",0,2021-01-08T21:09:09Z,2021-01-08T21:09:09Z
@wuzomed,"So 70 million people are evil lunatics? This line of thought is what empowered Trump. You did not learn your lesson. 
Funny thing is if we don't have some sort of Covid/Quarantine scenario in 2024 elections you will learn the same lesson that made you cry in 2016. 70 million Americans are not racist evil lunatics. You sir are un-hinged with pre conceived generalization.",0,2021-01-08T19:09:53Z,2021-01-08T19:09:53Z
@carriediamond3131,Cenk's a busy guy...he's got an entire country to destroy.,1,2021-01-08T18:57:23Z,2021-01-08T18:57:23Z
@jasonrobertson216,Wish I could show this video to an 18-20 year old Cenk 😂,0,2021-01-08T18:03:41Z,2021-01-08T18:03:41Z
@traceywright6938,Trump is not going to inauguration. Because he as something planned. He wants to deny involvement.,0,2021-01-08T17:25:07Z,2021-01-08T17:25:07Z
@mcclurge,The KKK doesn't wear white sheets anymore. They're wearing trump gear. Let's remember these people remember segregation. they have been raised to believe black people are beneath them.,0,2021-01-08T16:41:58Z,2021-01-08T16:41:58Z
@TheBest-sd2qf,"Cenk man, don't spread lies, there was no violence commited by Trump supporters, if there was the footage would be all over, but all you can find is footage of trump supporters running around, it actually looks a bit like someone playing catch. Yeah dumb as hell but terrorism, pearl harbour? Comon man..you are inciting hysteria.",0,2021-01-08T16:26:31Z,2021-01-08T16:27:34Z
@supergooner7581,"Is it just me or the reason the Police intervened ,take control of the situation and make a cover - up,",0,2021-01-08T16:14:57Z,2021-01-08T16:14:57Z
@TheBest-sd2qf,"A coup attempt, really? A bunch of Maga dudes with beer guts running confused  around in hallways, clearly with no direction and plan. Hardly the most efficient coup ever.",0,2021-01-08T16:14:41Z,2021-01-08T16:14:41Z
@alisade127,I think Trump directed the Defense Dept to deny the request.,1,2021-01-08T16:00:51Z,2021-01-08T16:00:51Z
@pvw732,Lock him up!,1,2021-01-08T15:49:37Z,2021-01-08T15:49:37Z
@ladonswift2779,"Those backstabbing capital cops could have crushed those seditionists but they were on their side. They probably said to those low life degenerates, we really appreciate you guys and give them water as the cops did in Kenosha, the dirty cop bastards even removed the barriers and literally released, admitted, and ushered those mag eating rats in the white house to have a whang, dang, doodle of a time while they all took selfies together. Each and every one of those scums should be in jail already.",0,2021-01-08T15:06:02Z,2021-01-08T15:06:02Z
@josegonzalez-kv1fp,I seen a video of a cop letting the people in is this real or fake?,0,2021-01-08T14:59:34Z,2021-01-08T14:59:34Z
@ajinkyatheboss1686,American Revolution 2020!,1,2021-01-08T14:36:31Z,2021-01-08T14:36:31Z
@sanjivat,That was some wierd shit -- I think it was George Bush who said that after Trumps inauguration speech. All come true now culminating in this despicable action by Trump.,0,2021-01-08T13:32:52Z,2021-01-08T13:32:52Z
@ryhk3293,This is not a coup attempt.  It's an insurrection.  A coup d'etat involves a deposition of a sitting leader.  A violent overthrow of authority and existing institutions is an insurrection.,0,2021-01-08T12:02:41Z,2021-01-08T12:02:41Z
@jafersultan,Always amazing show,0,2021-01-08T07:51:38Z,2021-01-08T07:51:38Z
@DEPARTMENTOFREDUNDANCYDEPT,"This is what happens when a malignant narcissist is elected president by a corrupt Republican Party and millions of gullible, ignorant fascist goons.",2,2021-01-08T06:57:04Z,2021-01-08T06:57:04Z
@firestorm1088,"After 9/11 when Bush made that speech saying Al Qaeda hate freedom I remember a friend of mine saying how stupid it is to say that people hate freedom and no one hates freedom. He was wrong, there are people who hate freedom because they know, in a free democratic country, people like them loose.",0,2021-01-08T06:09:34Z,2021-01-08T06:09:34Z
@pondartinc4002,I'm afraid of Guilani. He looks tough. HSAHAHAHAHAAA,0,2021-01-08T06:06:56Z,2021-01-08T06:06:56Z
@harrylfullen,What About the Cells! Operating! In other States and Cities! Beyond this Point!,0,2021-01-08T05:42:20Z,2021-01-08T05:42:20Z
@harrylfullen,The! British! Are! Coming!,0,2021-01-08T05:36:33Z,2021-01-08T05:36:33Z
@ahmedjartu1131,Stand down stand-by proud boys,0,2021-01-08T05:32:15Z,2021-01-08T05:32:15Z
@harrylfullen,Your Going To Get Treated! Like! Your Black!,0,2021-01-08T05:32:06Z,2021-01-08T05:32:06Z
@harrylfullen,If it wasn't for you black people! This would have never happened! How inhumane! In the! Melting Pot!,0,2021-01-08T05:28:42Z,2021-01-08T05:28:42Z
@patricelumumba2470,"Not since 1814 has the capitol been breached like this in an apparent attempt to keep Trump in office. The ""Dear Leader"" can't accept losing in any capacity.",1,2021-01-08T05:14:18Z,2021-01-08T05:14:18Z
@danwhite5339,"You lose your train of thought thanking people who give you $5. It doesn't fit with your supposed concerned tone. Breaking news, THE CAPITOL IS UNDER SIEGE...but first thanks Anthony for your $5 super chat.",0,2021-01-08T04:54:05Z,2021-01-08T04:54:05Z
@nathanweber1653,Are you surprised?,0,2021-01-08T04:18:08Z,2021-01-08T04:18:08Z
@donnalyons4772,"Where the blk people, they are missing.",0,2021-01-08T04:04:22Z,2021-01-08T04:04:22Z
@rich0471,"Fraud

Sellout",0,2021-01-08T03:59:00Z,2021-01-08T03:59:00Z
@senakandy6405,"Very sad, Cant beleive this is happening USA... The world has lost its respect for USA... now they cant preach to the world what they cant practice. 
Sad day for democracy in USA, It will be engraved in  history books for ever..",0,2021-01-08T03:21:33Z,2021-01-08T03:21:33Z
@hmetv3907,Everybody talking as if this the worse thing that ever happened in American history and no one went to jail. 🤯🤦🏿‍♂️🤷🏿‍♂️,0,2021-01-08T02:28:59Z,2021-01-08T02:28:59Z
@jamesstevenson7725,"Trump and these Republicans must be arrested, tried, and publicly excecuted",2,2021-01-08T02:14:52Z,2021-01-08T02:14:52Z
@jackkulinski8132,"Bruh, Trump 2024. Piss off",0,2021-01-08T01:59:30Z,2021-01-08T01:59:30Z
@MH-oh8rn,Why are you all concerned about violent protest all of a sudden this crap has been going on for a long time with black lives matter movement.  In fact if this were a black lives matter group there you guys would support them . This is what happens when there is corruption going on in politics and the media reports nothing but propaganda.  This mess is way bigger than a Trump problem  sites like this are one of our problems also nothing but a bunch a propaganda.  Deep corruption on both sides Joe and his side kick are amongst them totally ridiculous.,0,2021-01-08T01:59:25Z,2021-01-08T01:59:25Z
@vidstoday671,"I don’t agree that all republicans are evil and racist but think that what happened at the capitol was outlandish, nearsighted, moot and a huge disgrace. I also think that sometimes tyt tries to demonize people that are different for more viewers. I wish we could let go of the identity politics and truly be progressive by both sides meeting in the middle. The media only portrays extreme left and extreme right. Talk to those around you and abroad and you will find that the majority are in the middle and very reasonable to debate with.",1,2021-01-08T01:40:09Z,2021-01-08T01:40:09Z
@EbonSkolli,"I'd say let's deport all the domestic terrorists, but there's no place on this planet I'd feel safe sending them. If any aliens are reading this, you have my permission to abduct these republican loonies and do whatever experiments you want on them.",0,2021-01-08T01:19:55Z,2021-01-08T01:19:55Z
@brokeninstrumental374,They white they will survive 😂🤣,0,2021-01-08T01:07:00Z,2021-01-08T01:07:00Z
@caryrohan7816,It started with him closing down any investigation into right wing extremists and the rise of racist hate groups.,0,2021-01-08T01:00:29Z,2021-01-08T01:00:29Z
@truestdude,Saw footage of 1 of the terrorists taking a selfie wt 1 of the security team members. He shud be fired immediately & investigated for possibly being in on this shit,0,2021-01-08T00:37:00Z,2021-01-08T00:37:32Z
@cococrisp8959,This is why real Americans consider the Republikkklan party to be the Russian government.,0,2021-01-08T00:09:49Z,2021-01-08T00:09:49Z
@sunnydel4972,Wow!!!!!!!!!!!!!,0,2021-01-08T00:06:49Z,2021-01-08T00:06:49Z
@pmartin7397,The cops let them in and welcomed them taking selfies with the protesters !,0,2021-01-07T23:47:10Z,2021-01-07T23:47:10Z
@ruffadamsthegreat.2662,"Why do I feel I gotta vet your stories.
Ijs☺️",0,2021-01-07T23:45:25Z,2021-01-07T23:45:25Z
@dewinurreborn6691,"Lots of members of congress laptops are stolen, including Pelosi, Sciff, Schumaker, Maxine Waters,Mc Conell, Nader etc....wow, I really want to see what are inside of it, must be wild like pedophilias, sacrifies, adrenochrome, corruption etc..........Laptops from Hell....👹🍕👹🍕👹🍕👹🍕👹🍕👹🍕👹",0,2021-01-07T23:43:32Z,2021-01-07T23:43:32Z
@ruffadamsthegreat.2662,Wat???😆,0,2021-01-07T23:42:57Z,2021-01-07T23:43:23Z
@deniseemond9263,"I would love to see him arrested , handcuffed and taken away as he leaves the White House.",1,2021-01-07T23:19:59Z,2021-01-07T23:19:59Z
@deniseemond9263,Trump wanted to be a dictator. Make no mistake Trump told his followers to go fight. I listened to his discussing rally.,0,2021-01-07T23:18:04Z,2021-01-07T23:18:04Z
@deniseemond9263,We see them clearly and shame on them,0,2021-01-07T23:16:24Z,2021-01-07T23:16:24Z
@daniellerner2936,Why is this man so angry?,0,2021-01-07T23:15:29Z,2021-01-07T23:15:29Z
@deniseemond9263,"My brother and his wife are Trump supporters. Needless to say he won’t speak to me. But that’s ok, because I have no respect for him.",0,2021-01-07T23:04:08Z,2021-01-07T23:04:08Z
@Schlotzinger,"Cenk, did you have a script for that speech? I guess not. It just exploded. I love that. 
And you're right: the rest of the world is shocked just shaking heads. It's unbelievable what happened and you need to get back your country.",0,2021-01-07T23:01:52Z,2021-01-07T23:01:52Z
@deniseemond9263,Traitors!!!!,0,2021-01-07T23:00:04Z,2021-01-07T23:00:04Z
@deniseemond9263,I hope that you suggest that our government or FBI go over pictures and find and arrest as many of those people as they can find. This was an act of war against their own country in my opinion. They are committing treason. They should be hung!!!,0,2021-01-07T22:57:40Z,2021-01-07T22:57:40Z
@marion.waithe2301,Banana Republic???? They're more sensible than Americans.,1,2021-01-07T22:51:04Z,2021-01-07T22:51:04Z
@CAPTALISM,The young turks are literally the new Main stream media.,1,2021-01-07T22:46:30Z,2021-01-07T22:46:30Z
@jasonabrian2763,If this is TYT content then why isn't it on the main website. Ads every 3 damn mins...,0,2021-01-07T22:36:41Z,2021-01-07T22:36:41Z
@bowragak,Still begging for money geee....give it up. you're not a news organisation... you dont do your own reporting you just regurgitate other people stories... sorry 1.51 in and you are begging...,0,2021-01-07T22:36:00Z,2021-01-07T22:36:00Z
@Paintguy75,"There is a rumor roaming around that they will all be back on January 19th & 20th to ""finish the job"". Let's hope DCPD, Capitol Police and the Secret Service are actually up to snuff this time.",0,2021-01-07T22:26:18Z,2021-01-07T22:26:18Z
@Ryang403,OH COME ON! IT'S ORBVERIOUSLY BLACK LIFES MATTER BEHIND THIS! THE PROTERSTARS WERE BLACK PEOPLE MADE UP WITH MAKE UP TO LOOK WHITE! ITS ANTIFA! ITS VANESWAYLA!! ALL FAKE NEWS AS MR DONALD SIR  SAYS!  IT'S BECAUSE THEY HATE A TRUE PAPERTRICK LIKE MR DONALD SIR!  ITS BECAUSE THEY STOOL THE ELIICTION!!  THE DEEMOONKRATS [ SEE HOW KLEAVER I WAS THER!!] ARE TO BLANEE FOR THIS !!,0,2021-01-07T22:11:07Z,2021-01-07T22:12:44Z
@matcatameba,This man will never be trustworthy and must be removed.  We try to shame him into becoming a good American but he just does what he wants anyway.,1,2021-01-07T22:04:28Z,2021-01-07T22:04:28Z
@joshuaciresoli2927,Like the Reichstag attack in 1933,0,2021-01-07T22:00:32Z,2021-01-07T22:00:32Z
@DJDirtyEars,"As a right wing libertarian, it's easy for me to condemn the actions of the morons who stormed the capitol building because I've been condemning non-peaceful protests since June. Consistency isn't as hard as The Young Turks make it look.",0,2021-01-07T21:56:43Z,2021-01-07T21:56:43Z
@jeremystone0105,Cenk Who’s gonna narrate the audio book!?,0,2021-01-07T21:56:19Z,2021-01-07T21:56:19Z
@xadoyamen2356,I knew it would go down this way,0,2021-01-07T21:52:27Z,2021-01-07T21:52:27Z
@Jellofreeze,@14:20 - 15:00 ......pure gold !,0,2021-01-07T21:50:42Z,2021-01-07T21:50:42Z
@hekatsees9449,"Cenk is pissed off...  It’s a shame, Tr*mp isn’t worthy of even anger. He deserves to be completely forgotten, at least for a couple of years. Media blackout on Tr*mp & his, so we have a chance of healing... And the domestic terrorists who stormed the Capital, need to be prosecuted as terrorists... Like, now... No fanfare, just action...",0,2021-01-07T21:47:11Z,2021-01-07T21:51:33Z
@susanosburn918,"Not all Republicans are as you say.  Trump has had to endure the left all four years.  The left have  disrupted  his four year services as our President.  Bogus Russian investigation , bogus impeachment, wasted time and money.",0,2021-01-07T21:45:02Z,2021-01-07T21:45:02Z
