User,Comment,Likes,Published At,Time Ago
@danprotheroe2663,USA is finished!,0,2021-01-06T23:00:44Z,2021-01-06T23:00:44Z
@KendrixTermina,"Of course Pence & the oldschool conservatives were the first against the wall, just like the monarchists in the Weimar republic",0,2021-01-06T23:00:41Z,2021-01-06T23:00:41Z
@olgamurdock2878,Throw all these gangster in prison for along time including trump.,0,2021-01-06T23:00:38Z,2021-01-06T23:00:38Z
@ebonysoulman,Trump has manipulated all of his fools again. He told them to stand back and stand by and that’s exactly what they did.  So much for 2021 being a better year.,1,2021-01-06T23:00:35Z,2021-01-06T23:00:35Z
@vivianpollak2233,Ted Rall has been saying this for months!,0,2021-01-06T23:00:32Z,2021-01-06T23:00:32Z
@heatherrobinson6756,Coup brought to you by the Richest Americans 40 years of bogus think tanks funded by Koke brothers spreading false propaganda like trickledown economics actually works.of course it clearly doesn’t just ask Paul Krugman the world renowned economist the Richest Americans have busted our unions so we can’t collectively bargain for our selves and the the Richest Americans want to pretend like every American is looking for handouts after they have corrupted our government to do their bidding to steal our wealth and safety nets that we already paid for,0,2021-01-06T23:00:23Z,2021-01-06T23:02:23Z
@davidrubaloff5725,Nice job Republicans you destroyed your party. Payback is going to be a bitch!,0,2021-01-06T23:00:16Z,2021-01-06T23:00:16Z
@satish8299,"Cenk and Anna is unfortunatly on the same line as CNN, it is so sad they did not support a roots movement and they did not shame the Squad and other democratic sentors for the Healthcare for all issue. Cenk is unfortunatly protecting the  small class of leaders, leaders that are not connected with the people.  The very large poor is large and the middle class is small, and the ruling class is even smaller.  The people in the middleclass are comfortable with the  mainstream news. The law and order story and the netflix story.",0,2021-01-06T23:00:06Z,2021-01-06T23:00:06Z
@johnwhite7320,What happened to Mussolini should happen to Trump.,0,2021-01-06T23:00:05Z,2021-01-06T23:00:05Z
@janedoe5048,"Is there any subject too important that Cenk might even just consider putting his hustle aside? We have the answer. No. Cenk, Bernnie and AOC, three people we watched turn into the very kind that they use to despise so much so that it became their platform. Everyone has their price. That Cenk would sacrifice Assange make him the worse out of the three gumps.",0,2021-01-06T22:59:54Z,2021-01-06T22:59:54Z
@terryhazelett2105,"A total disgrace and all who arrested should be charged with treason along with their leaders, TRUMP and Guilliani.",0,2021-01-06T22:59:50Z,2021-01-06T22:59:50Z
@petercarri718,"I am pissed off! 
Where were the national guard?
Why are law enforcement not forcing these losers away!😠",0,2021-01-06T22:59:49Z,2021-01-06T22:59:49Z
@jeffjordan3806,"The Republicans, ALL Republicans, have enabled and supported this. They could have prevented this at the impeachment of DJT, just like they could have prevented the Covid pandemic, killing all these Americans. When you build, support and unleash a monster, what do you expect?",0,2021-01-06T22:59:38Z,2021-01-06T22:59:38Z
@stacyxiong8307,They have 3 minutes to clear the streets before curfew starts. I doubt the police will treat them like they did us during our BLM march!,40,2021-01-06T22:59:37Z,2021-01-06T22:59:37Z
@jeanellis6793,"The military should protect Biden and Harris so that no harm is done to them.  Trump, Cruz, Guiliani, and the many others should be arrested for inciting the violent riot.  They have committed treason.  It should not be ignored or disregarded.",0,2021-01-06T22:59:36Z,2021-01-06T22:59:36Z
@Cng215,These people are crazy!!! Americas descending into chaos,0,2021-01-06T22:59:33Z,2021-01-06T22:59:33Z
@bigboss-ks5jb,A coo,0,2021-01-06T22:59:33Z,2021-01-06T22:59:33Z
@thaddepaul1231,"PUTIN IS IN JOY OVER DONALD TRUMP ENCOURAGING VIOLENCE AND CREATING MAYHEM IN THE CAPITOL

THIS IS HIGH TREASON AND DONALD AND HIS MAYHEN BOYS MUST FACE TRIAL FOR ATTEMPTED COUP",0,2021-01-06T22:59:27Z,2021-01-06T22:59:27Z
@LeNoir679,"I hope they put the goddamn fear of God into Mike Pence, LOOK AT WHAT YOU WROUGHT IN YOUR LUST FOR POWER YOU WERE AN ACCOMPLICE TO THIS BY STANDING WITH TRUMP UNTIL THE 11TH HOUR",0,2021-01-06T22:59:26Z,2021-01-06T22:59:51Z
@mvuto137,IMPEACH... then JAIL... then have the IRS audit the keys.,0,2021-01-06T22:59:21Z,2021-01-06T22:59:21Z
@MrDaniell1234,This is ball shit and there is only one person to blame.,0,2021-01-06T22:59:15Z,2021-01-06T22:59:15Z
@theshadowoftruth7561,impeach Trump Tomorrow!,0,2021-01-06T22:59:07Z,2021-01-06T22:59:07Z
@woodjilla,I sure do wish Wakanda was real!!!,1,2021-01-06T22:59:00Z,2021-01-06T22:59:00Z
@dtlegacy2495,"People say America is the greatest country in the world and yet those same people let this happen. This is what happens when you encourage violence against your own country. This has to stop and something needs to be done right now! America needs to be change and we must challenge the powerful. Otherwise America will not last. You want to make America better and stop fascism, join the fight for change and progress. If not, stay out and shut up!",0,2021-01-06T22:59:00Z,2021-01-06T22:59:00Z
@sallyreynolds3410,Where the hell was the National guards? If the flags said Black Lives Matter they would be in jail by now,0,2021-01-06T22:58:59Z,2021-01-06T22:58:59Z
@grahambridge3437,America under trump has become a joke around the world. This is at a time when the west needs America to be sober and focused to help deal with an expansionist China,0,2021-01-06T22:58:59Z,2021-01-06T22:58:59Z
@mrrasbumboclat4120,how hard they fight for Trumpolini so they can have jim crow back,0,2021-01-06T22:58:56Z,2021-01-06T22:58:56Z
@ravondal1958,"Damn while ""reporting"" you just simply cant stop advertising. My heart is saddened. You not really different then FOX. I have had enough of your shit. Bye bye.",0,2021-01-06T22:58:52Z,2021-01-06T22:58:52Z
@flossiesarboretum7118,"I think it’s a mistake to say the height of insanity has been reached.
Unless t-slime croaks in his sleep, tonight.",12,2021-01-06T22:58:51Z,2021-01-06T22:58:51Z
@stephaniebilansky5238,Trump created this situation and the government allowed it to happen.,0,2021-01-06T22:58:41Z,2021-01-06T22:58:41Z
@bernadettegrant6326,"Biden is too soft can't run terrorist with dat soft soaping , begging attitude
 He won't get respect that way 

 with that soft soaping",0,2021-01-06T22:58:38Z,2021-01-06T22:58:38Z
@ChristmasLore,"I watched from France, and it was mesmerizing. Like a really bad movie.
How are they not retiring trump right this instant?
The man has proven over and over just how dangerous he could be.",0,2021-01-06T22:58:36Z,2021-01-06T22:58:36Z
@jasonriehl6981,I cant believe this omg,0,2021-01-06T22:58:34Z,2021-01-06T22:58:34Z
@kevinlocke4515,Antifa everywhere.,0,2021-01-06T22:58:34Z,2021-01-06T22:58:34Z
@Phil4RealMusic,the chick DIED wrapped in a Trump flag,0,2021-01-06T22:58:27Z,2021-01-06T22:58:27Z
@ceonach,I can hear Putin laughing.,33,2021-01-06T22:58:26Z,2021-01-06T22:58:26Z
@mzres165,"You apart of the problem, the lies the lies. The coup been done by traitors and corrupt politicians for years. Its time to stop them once and for ALL. ✋ the BS you spewing.",0,2021-01-06T22:58:21Z,2021-01-06T22:58:21Z
@GO-nh6br,"Why are they protesting their not going to change the results...45 lost nice and clean, we won the electoral college,  the same electoral college that 45 won. MOST REPUBLICANS ARE CONFEDERATES OR RASIST AND HATE DEMOCRACY...",0,2021-01-06T22:58:14Z,2021-01-06T23:01:43Z
@davidrubaloff5725,Very sad for America today. These anarchist were give permission by Donald Trump and his hard core supporters.   There have to be consequences for all of these seditious undemocratic and disenfranchisement of America.,0,2021-01-06T22:58:13Z,2021-01-06T22:58:13Z
@angelpadilla8911,"I’m willing to give my life for democracy, just ask and I’ll be there all. Please, country first, before family or anything in this world  I hate being American now. Kill all those attempting to overthrow our democracy. Just let me know, I’ll be there in whashington.",0,2021-01-06T22:58:13Z,2021-01-06T22:58:13Z
@jacquescouture7505,arrest this clown and directly in Guantanamo,0,2021-01-06T22:58:11Z,2021-01-06T22:58:11Z
@jameshood1928,"We have seen an insurrection today. Trump continues to justify it. Giuliani  spoke of armed combat this morning. Hawley and Cruz are traitors, along with 11 other senators. Pathetic that the U.S. has sunk to this level. Confederate flags in the Capitol. For shame!!",0,2021-01-06T22:58:09Z,2021-01-06T22:58:09Z
@donellefeltham,"I knew he was dangerous but I’d hoped,foolishly, that he wouldn’t do this but he has he caused this uprising and he should be arrested. He’s been on a mission to cause this insanity and you can bet he’s beating his chest thinking he’s got his wish. The Republicans should have had the guts to stand up to him weeks ago, not now when their cohorts are being threatened with such violence.🎼❤️🇦🇺❤️🇺🇸🤷‍♀️🤦‍♀️",0,2021-01-06T22:58:08Z,2021-01-06T22:58:08Z
@depenpandya8421,A very sad and scary time in American politics! When will the old maniac Trump we arrested and held accountable!!!!,0,2021-01-06T22:58:04Z,2021-01-06T22:58:04Z
@lindajones4080,And yet the police loves Trump 🤦🤦🤦🤦🤦💗,0,2021-01-06T22:58:00Z,2021-01-06T22:58:00Z
@monticae,"Calm down Cenk!! We are progressives but not trying to ignite further hate and aggression towards our opposition. I’m sorry but your aggressive attitude needs to include some level headed patient thinking. You think progressives aren’t vulnerable to take to the streets after hearing your rant?! We Are! Now’s the time to be supportive of each other’s  mental health and well being in the light of chaos and injustice. Listen to your own “super angry voice”. Ana, please calm down the TYT vibe for US YOUR MEMBERS! Don’t be like CNN with dramatic buzzwords to keep people tuned. We need to ENCOURAGE PATIENCE AND MINDFULNESS!",0,2021-01-06T22:57:57Z,2021-01-06T22:57:57Z
@MarshaABranch,Trump doesn't hate America.  It takes someone who actually gives a damned to feel hate.  He is indifferent toward America and anything and everyone that is not himself.,0,2021-01-06T22:57:56Z,2021-01-06T22:58:11Z
@zyrrhos,"Oh good, I don't subscribe to TYT. Came up on my recommends. Outta here.",0,2021-01-06T22:57:55Z,2021-01-06T22:57:55Z
@rpena,Bunch of thugs. Is America great yet?,0,2021-01-06T22:57:48Z,2021-01-06T22:57:48Z
@boldbeautiful4725,Sad that woman died all because of stupidity!!,0,2021-01-06T22:57:46Z,2021-01-06T22:57:46Z
@flowersfromh-evanlakshmi7577,The fall of the USA REPUBLIC.,0,2021-01-06T22:57:41Z,2021-01-06T22:57:41Z
@sheiladodds4186,Tuning in from BC Canada...WTF is happening to my neighbors to the South? The whole freaking world is watching.,0,2021-01-06T22:57:40Z,2021-01-06T22:57:40Z
@henrymartinez5217,WHEN IDIOTS RULE IT'S A SIGN OF DESPERATION  OF COCKOO BABYS WITH GUNS .      LACK OF CIVILITY THAT REPUPLICAN OPPERATIVES OF THE TRUMPF CALL FOR SHOW CAVEMAN'S  FEVER.      THE CIVIL WAR AGAINST OWNING OF BLACK PEOPLE WAS WON BY THE UNION NOT THE SOUTHERN STATES.       ALL PERPS OF INVADING THE CONGRESS DESERVE PRISON TIME FOR ATTACK ON INSTITUTIONAL   SEATS OF DEMOCRACY,0,2021-01-06T22:57:40Z,2021-01-06T22:57:40Z
@Pulang_Diwa,Y'all remember when the commies in Russia stormed inside the monarch's home and massacred the Romanov's? Or when the N*zis engineered the Beer Hall Putsch? Or when the Italian Blackshirts marched into Rome? Do these Trump morons sincerely believe this is going to go well for them?,0,2021-01-06T22:57:32Z,2021-01-06T22:57:32Z
@bitflogger,"This had to happen, a backlash to Black voting.  Luckily the bad guys may be more incompetent than the Democrats. Good rant!",0,2021-01-06T22:57:32Z,2021-01-06T23:03:25Z
@oscarhoward6505,These are the type of police that love policing the black community.,0,2021-01-06T22:57:27Z,2021-01-06T22:57:27Z
@jennifergermain7131,and if they were black lives matter protesters they would have been teargassed then shot.  There you go GOP reaping what you have sewn,0,2021-01-06T22:57:27Z,2021-01-06T22:57:27Z
@alecmolina3005,TRUMP SUPPORTERS DONT SEASON THEIR CHICKEN!!,0,2021-01-06T22:57:27Z,2021-01-06T22:57:27Z
@quangutusuranu,When the left protest the media supports it wholeheartedly. When the right protest everyone cries terrorism.,0,2021-01-06T22:57:17Z,2021-01-06T22:57:17Z
@educatingfool216,"The most disturbing reality,  this was coming a mile away and the Capital wasn't protect, on purpose. Fascism is alive and kicking.",0,2021-01-06T22:57:17Z,2021-01-06T22:57:17Z
@chattemr5992,The MAGA terror network must be dismantled and the leaders prosecuted.,0,2021-01-06T22:57:16Z,2021-01-06T22:57:16Z
@janettucker3196,Bad male behavior.,0,2021-01-06T22:57:07Z,2021-01-06T22:57:07Z
@fractalign,"Just waiting for the MAGA posse to blame George Soros,  BLM and Antifa on the attacks.",15,2021-01-06T22:57:04Z,2021-01-06T22:57:04Z
@buckeyewill2166,"When Trump was elected, I knew our nightmare was about to begin.....",50,2021-01-06T22:57:03Z,2021-01-06T22:57:03Z
@ghanabaa,"i can confidently say that   the usa is now a third world  country.welcome  to the club sis,looooolllxxx",0,2021-01-06T22:57:03Z,2021-01-06T22:57:03Z
@pebmets,This is  the work of Trump and his enablers.  They said no harm to appease him all this time.   Here is your harm.,0,2021-01-06T22:56:56Z,2021-01-06T22:56:56Z
@robmac5086,"I feel for the lady that was shot, I hope she's pulls through , Again Trump sending out his Russian message to cause havoc and division,  and fake stolen election, I'm sorry but the best thing to come out of this was seeing the Republicans hiding with face masks on, you get what you sow !! Also BUNKER BOY where was little Donnie, He's such a LOSER !!!!!",1,2021-01-06T22:56:52Z,2021-01-06T22:56:52Z
@BlackAmerican2,I'm confused. Where is the race soldiers? No cops feeling threaten? No heavily armed soldiers? Aren't these people doing exactly what they claim BLM and Antifa do?,40,2021-01-06T22:56:39Z,2021-01-07T04:06:37Z
@kiwibaldy3389,Ted Cruz has a lot to answer for,0,2021-01-06T22:56:34Z,2021-01-06T22:56:34Z
@bernadettegrant6326,No tear gas nutten if dat was blks somebody wud b dead as police wud b there in 2 minutes . America is falling?,0,2021-01-06T22:56:13Z,2021-01-06T22:56:13Z
@roberthoeller5516,"If, when the congress reconvenes and they (the Hawley, Cruz,etc.) don’t stop these “complaints “ to derail the electoral confirmation of Biden, then they are advocating these insurrectionists.",2,2021-01-06T22:56:11Z,2021-01-06T22:57:51Z
@off__world8668,This is what happens when the 1% trap all Americas wealth in it's net,0,2021-01-06T22:56:09Z,2021-01-06T22:56:09Z
@alecmolina3005,Trump supporters love to kiss their own cousins,1,2021-01-06T22:56:05Z,2021-01-06T22:56:05Z
@crazysteve2362,Trump and everyone who supports him is a communist,2,2021-01-06T22:56:03Z,2021-01-06T22:56:03Z
@mrrasbumboclat4120,"if that was a black crowd can you imagine the response, I bet some off duty officers in that protest crowd. need Rico everyone in that crowd and lock them up",129,2021-01-06T22:56:00Z,2021-01-06T22:56:00Z
@wintermutevsneuromancer8299,hihi - usa is a joke,0,2021-01-06T22:55:59Z,2021-01-06T22:55:59Z
@melissabill1640,"Relax. Not a coup, just a riot.  Police will bring it under control.  Liberals were nearly this mad when Trump won 4 years ago.",0,2021-01-06T22:55:59Z,2021-01-06T22:55:59Z
@elpatriotamexicano,*A CIVIL WAR IS WHAT THE WHOLE WORLD IS WAITING TO SEE HAHAHAHA !!!!*,0,2021-01-06T22:55:55Z,2021-01-06T22:55:55Z
@barrymauger8610,There was a cop in the building that posed for a selfie with one of them.,0,2021-01-06T22:55:47Z,2021-01-06T22:55:47Z
@guhleeep,"Reporting on active insurrection, you take the time to sell ""Too Strong Coffee""",2,2021-01-06T22:55:44Z,2021-01-06T22:55:44Z
@ComradeOgilvy1984,MAGA is here to take us back to 1814.,0,2021-01-06T22:55:39Z,2021-01-06T22:55:39Z
@buckeyewill2166,Bad News Wednesday.....,0,2021-01-06T22:55:33Z,2021-01-06T22:55:33Z
@fatimamadni1272,Hahahahah can't stop laughing you guys are screwed,0,2021-01-06T22:55:29Z,2021-01-06T22:55:29Z
@oumgia5643,"it's an insurrection, exactly as defined",0,2021-01-06T22:55:14Z,2021-01-06T22:55:14Z
@raycebannon6374,Damn Cenk - imagine if your voice had this much passion for Med4All?,0,2021-01-06T22:55:12Z,2021-01-06T22:55:12Z
@hisojaper4600,"The laughing stock of the world  ,fascist America, happy days",0,2021-01-06T22:55:11Z,2021-01-06T22:55:11Z
@michaellombardi1620,Peak madness,0,2021-01-06T22:55:07Z,2021-01-06T22:55:07Z
@peteaplin8324,The real Trump derangement syndrome.....,0,2021-01-06T22:55:04Z,2021-01-06T22:55:04Z
@kentinman2326,"Sedition. Plain and simple.
  ""Oh but let's look forward not back.""  
                              🤔",0,2021-01-06T22:55:00Z,2021-01-06T22:55:00Z
@pchan232,Arrest everyone for domestic terrorism.,0,2021-01-06T22:54:58Z,2021-01-06T22:55:33Z
@emptyemptiness8372,"Next time maybe listen to your allies. In 1987 Trump was declared a national security threat by the Australian govt and denied a casino licence for Sydney NSW because of mob ties and corrupt business practices. This was not done idly, it was the result of cooperation by multiple federal police investigations in the US and Australia to inform the Australian govt as to wether he was fit for a casino licence......he wasnt...and he certainly wasnt fit to be President.",1,2021-01-06T22:54:57Z,2021-01-06T22:54:57Z
@michaelpuig9973,"Why are not these people arrested?  This is happening under a so-called law and order president.  This far worst that the Black Lives Matter protest earlier this year.  If they want a dictatorship then they should emigrate to Russia or China, they both have a strong dictatorship!  America is still a democratic country with a democratic Elected President.",0,2021-01-06T22:54:53Z,2021-01-06T22:54:53Z
@lewa3910,Rightwing thugs must be beaten,0,2021-01-06T22:54:34Z,2021-01-06T22:54:34Z
@midnightdoom4466,Ok Cenk. Keep peddling this BS.. almost like you want a civil war as you contribute to the divide,0,2021-01-06T22:54:32Z,2021-01-06T22:54:32Z
@marybeam7002,interesting thing to take note of here is that these people who actually entered federal buildings were treated with kid gloves compared to the BLM protest during Trumps photo op. Why are white conservative 'radicals'  treated hands off.,0,2021-01-06T22:54:31Z,2021-01-06T22:54:31Z
@songomatic9897,"Remember, Democrats won.

Republicans, Trumpsters and racist thugs lost.",0,2021-01-06T22:54:28Z,2021-01-06T22:54:28Z
@kennycnez4275,Trump and the whole Rico Republican Treasonous Traitors should be arrested for Treason,1,2021-01-06T22:54:27Z,2021-01-06T22:54:27Z
@megdakun7910,"Today, America lost the moral rights to intervene in any elections quabbles in the world",19,2021-01-06T22:54:25Z,2021-01-06T22:54:25Z
@justoC714,I better see tanks soon or I'm driving from Massachusetts,0,2021-01-06T22:54:23Z,2021-01-06T22:54:23Z
@alonzocastoire7779,I told everyone that this was going to happen.,1,2021-01-06T22:54:22Z,2021-01-06T22:54:22Z
@purplesue66,They know he didn’t win. LOCK THEM UP and TIMES UP for tolerating trumps crimes.,0,2021-01-06T22:54:21Z,2021-01-06T22:54:21Z
@josephdonahue2054,"Saddest day for America in my lifetime.  Every headline on earth tomorrow will be ""America under Siege""! Absolutely shameful.  Way to go Trump..... Pack your bags and get the hell out of here! You are worse than any other tyrant in the world because you started off with the greatest country in the world.....",1,2021-01-06T22:54:20Z,2021-01-06T22:54:20Z
@larrym1439,"But these protesters weren't gassed were they. No. They were manipulated by the president to bring a halt to election certification by force, but for some reason, he is still being treated as some sort of lovable mental patient, rather than the treasonous carpetbagger that he is.",0,2021-01-06T22:54:15Z,2021-01-06T22:54:15Z
@sr2291,They also liked Trump because he mentioned God and Jesus and prayed in public places.,0,2021-01-06T22:54:14Z,2021-01-06T22:54:14Z
@jivejam5874,"i suggest a conferencd in philly including sanders, buffet, trump. weinstein, you, a musician, basketball player,  poet, etc like atlantis by donavan, lock them in independence hall and we watch, we offer food, okay locked is harsh, talk together, bob dylan, chris wallace, deb della, ed snowden,  bezos zuckerberg, woody allen - face the nation together - in philly, its co- fe- fe time!? and you dont get out til u sign.  like a hamilton vs jefferson ro, it might take months but would be well worth it, also an expert farmer, mathematician, and engineer if any9ne knows of one, imagine the stars together",0,2021-01-06T22:54:08Z,2021-01-07T00:34:13Z
@earnestineray8199,What's happening is treason and rebellion AND TRUMP and anyone supporting AND enabling him and his actions against our country and its citizens should be held accountable period!,0,2021-01-06T22:54:02Z,2021-01-06T22:54:02Z
@dadams8086,"Trump has humiliated this country.  He needs to pay for the rioting and seditious crap happening in our capital.  Every god damn one of these people need to be in prison.  Oh, I forgot.  Trump will pardon all of them.",0,2021-01-06T22:53:59Z,2021-01-06T22:53:59Z
@mrsroseyp109,How was the police totally unprepared? Doesn’t make any sense,8,2021-01-06T22:53:56Z,2021-01-06T22:53:56Z
@edmondpereira4595,As predicted he is burning the house down before he is expelled. Set his arse on fire in prison on the 21st of Jan. Guantanamo never looked so good for seditious trump.,0,2021-01-06T22:53:56Z,2021-01-06T22:53:56Z
@robertbrawley5048,"CENK forced me to view majn stream media , NBC News to get the truth. The woman that was shot was shot by ,law
 enforcement",0,2021-01-06T22:53:53Z,2021-01-06T22:54:36Z
@catalhuyuk7,The woman who was shot died.,0,2021-01-06T22:53:53Z,2021-01-06T22:53:53Z
@notebooks6461,"This is the true face of Trump and his cultists
""Police wasn't prepared"" is the biggest boldest lie I've ever seen",61,2021-01-06T22:53:40Z,2021-01-06T22:53:40Z
@Whim-wham_whistling_shark,The fascists are trying to take over. We need to start calling them what they really are traders!,1,2021-01-06T22:53:36Z,2021-01-06T22:53:36Z
@jemilachen,"America, a beacon of light for the rest of the world... seriously? Just a decoy for decades that finally shows its real face.
The dream is over, everyone is now awake.",0,2021-01-06T22:53:35Z,2021-01-06T22:54:55Z
@geared2cre8,"LOCK THEM UP 
LOCK THEM UP
LOCK THEM UP",0,2021-01-06T22:53:31Z,2021-01-06T22:53:31Z
@oldtimer7635,I am so happy not living in a banana republic like USA! : ),0,2021-01-06T22:53:28Z,2021-01-06T22:53:28Z
@EAZUP,Where are the cop beatings...if that was the BLM. They would had killed most of them.,1,2021-01-06T22:53:27Z,2021-01-06T22:53:27Z
@patriciaedgar9208,Trump needs to be in jail as we speaks !!!!!!,0,2021-01-06T22:53:24Z,2021-01-06T22:53:24Z
@terryolsson4145,"That monster Trump HAS BLOOD ON HIS HANDS.  HE INCITED THIS, HE ENCOURAGED THIS.  ARREST HIM  ARREST HIM   ARREST HIM  ARREST HIM ARREST HIM!!!!!!!",0,2021-01-06T22:53:19Z,2021-01-06T22:53:19Z
@tessietesoro7407,America is going down to the dogs.,0,2021-01-06T22:53:19Z,2021-01-06T22:53:19Z
@robs6513,"FOR WEEKS TRUMP ASKED THESE MALITIAS TO COME TO WASHINGTON ON JAN 6TH
TODAY TRUMP SAID MARCH ON THE CAPITAL",15,2021-01-06T22:53:18Z,2021-01-06T22:53:18Z
@pchan232,"Someone do something to Fox fake news, they have had hand their hands in this bullshit for too long.",0,2021-01-06T22:53:15Z,2021-01-06T22:53:33Z
@rychardshelton4336,Woman who was shot inside capital died!.. Which asshole Trump supporters want to take responsibility for this?,0,2021-01-06T22:52:58Z,2021-01-06T22:52:58Z
@jeffjordan3806,I'm concerned. You look like you might have a heart attack. Calm down. Take a breath.,1,2021-01-06T22:52:51Z,2021-01-06T22:52:51Z
@robertdubois2685,Well Cenk its official Trump has made America into one of those Shit-Hole countries he talked about. Its a sad day to see what the USA has become. :(,0,2021-01-06T22:52:46Z,2021-01-06T22:52:46Z
@guapodesperado2822,"January 6th, 2021, the day that everyday Americans bore witness to the undeniable fact that they have far more to fear from the American far-right extremists than the pandemic, antifa, radical Islam, the Russians, Chinese, and North Koreans all combined.",1,2021-01-06T22:52:44Z,2021-01-06T22:52:44Z
@gregorybarr8258,America the World is watching and what we are seeing is a Disgrace..How can you talk to other Nations about Democracy...Please get a life..you elect a Crazy man who has brought you to this embracing moment...I had the greatest respect for the USA...but now wow what can I say...have to do better.,0,2021-01-06T22:52:29Z,2021-01-06T22:52:29Z
@revwroth3698,"I don't see how the term ""banana republic"" applies...",0,2021-01-06T22:52:20Z,2021-01-06T22:52:20Z
@athomas1124,Wowwww!!!! No one beat up? No one killed? No arrests? These fine people of Trumps’ era have taken over the Capitol!! So the police don’t know what to do to these fine people? Wow!!,1,2021-01-06T22:52:15Z,2021-01-06T22:52:15Z
@Nate-ln1qk,"Stop all your bellyaching Feller, 
Be proud to be an American",0,2021-01-06T22:52:14Z,2021-01-06T22:52:14Z
@anotherbutt4chair56,"This is treason, but they are white? So they will probably downplay the whole thing.",1,2021-01-06T22:52:12Z,2021-01-06T22:52:12Z
@elijawaealshabazz1796,Say it Cenk!!!!!,0,2021-01-06T22:52:12Z,2021-01-06T22:52:12Z
@raunacbhuiyan2087,Cry more libs,0,2021-01-06T22:52:09Z,2021-01-06T22:52:09Z
