User,Comment,Likes,Published At,Time Ago
@LuisHernandez-vc8ew,"Took the land from the natives ...now they are taking it from the common ppl ...give the stolen property back the the natives ""and let us run the country...MAKE  AMERICA GOOD AGAIN!!!",0,2021-01-07T00:44:42Z,2021-01-07T00:44:42Z
@nathanielmorphew7855,California Farmers For Trump.,0,2021-01-07T00:43:23Z,2021-01-07T00:43:23Z
@seaturtledog,Putin's man is doing his part to bring chaos.,0,2021-01-07T00:43:20Z,2021-01-07T00:43:20Z
@Tmueller2366,Arrest Trump tonight!!!,0,2021-01-07T00:43:10Z,2021-01-07T00:43:10Z
@Kelly-bw1zo,"If it was BLM, a lot of us would have been shot!",0,2021-01-07T00:43:02Z,2021-01-07T00:43:02Z
@gregoryjudie7704,What amazes me is the media making excuses for the Metropolitan Police being unprepared and that's why the rioters got into the building the truth is a lot of the Metropolitan Police elitist and had to have left them in that's why there was no one there to stop their entry,0,2021-01-07T00:43:01Z,2021-01-07T00:43:01Z
@maryhingston3209,Ted Cruz and Hawley should resign!,0,2021-01-07T00:42:56Z,2021-01-07T00:42:56Z
@trumpermeltdown5329,"This is a total Trumper meltdown. This coup needs to be shutdown , pronto. Trump is a mad king , enact the 25th amendment before it's too late ! 🇺🇸",0,2021-01-07T00:42:49Z,2021-01-07T00:42:49Z
@K4R3N,Effing MAGGATS,0,2021-01-07T00:42:42Z,2021-01-07T00:42:42Z
@batsman2755,"Donald Trump said he wanted another Venezuela, and he's trying to get it done today. It's a shame he has 2 more weeks left.  It's SEDITION AND TREASON.",0,2021-01-07T00:42:36Z,2021-01-07T00:42:36Z
@Kelly-bw1zo,You sound like how most of us feel...with all your emotions!!!,0,2021-01-07T00:42:21Z,2021-01-07T00:42:21Z
@nomadgatewood4143,"So vandalizing a slave owners statue is unamerican...........vandalizing the nations capital is somehow patriotic. Trump fluffers ........pull your pants up, your treason is showing.",1,2021-01-07T00:42:13Z,2021-01-07T00:42:13Z
@brodypentek5474,looks like they need some TOO STRONG COFFEE to sop up some of those maga tears AMIRITECENK!?!?,0,2021-01-07T00:42:08Z,2021-01-07T00:42:08Z
@ndjululuuutena3374,"If I was a sensible Republican,  I either leave the Republican party or Trump must leave.  It's an international embarrassment especially to American army that goes internationally as peace makers. It's more than an insult to the America the world look at for democracy",0,2021-01-07T00:41:53Z,2021-01-07T00:41:53Z
@avotreemansanders3289,"If the 25th amendment is not used now, then when would it be the right time???",0,2021-01-07T00:41:39Z,2021-01-07T00:41:39Z
@zarionwildclaw4172,You can't buy this level comedy. I'm loving every single second of this nonsense. I've literally not stopped smiling in some form for hours now. This orange idiot is promising glorious insanity right up until the end. I can't wait to see what tomorrow bring. And the there's still January 20th to look forward to!,0,2021-01-07T00:41:25Z,2021-01-07T00:41:25Z
@kcleong8224,The United States of America is totally finished!,0,2021-01-07T00:41:15Z,2021-01-07T00:41:15Z
@stewartsaunders699,Shame on TYT. Main project; make adds make blood money.   Your made of the same stuff.,0,2021-01-07T00:41:14Z,2021-01-07T00:41:14Z
@uriahheep5665,"There are but two parties now: traitors and patriots.
And I want hereafter to be ranked with the latter and, I trust, the stronger party.

--Ulysses S. Grant",0,2021-01-07T00:41:03Z,2021-01-07T00:41:03Z
@renen5315,"Trump incited after his rally this feeble-minded people, who had gone mad already. Trump must be arrested for inciting such great violence.",0,2021-01-07T00:40:37Z,2021-01-07T00:40:37Z
@ChuckNorris-qg2et,"THIS IS GOOD YOU DUMMIES! DESTROY THE  CORPORATE, CORRUPT, ELITIST SYSTEM",0,2021-01-07T00:40:35Z,2021-01-07T00:40:35Z
@girllearningtheworld565,Arrest anyone you can doing this coup  and  charge them with treason and remove them from America PERIOD.,1,2021-01-07T00:40:32Z,2021-01-07T00:40:32Z
@alfredkay3210,"Make America A Banana Republic Again - ""MAABRA""",0,2021-01-07T00:40:29Z,2021-01-07T00:40:29Z
@jorgeg0327,"The real issue is not MAGA but the government. People are tired of the government, tired of the oligarchy, tired of getting screwed by their ELECTED officials. 
Trump tapped into this hate and is using it towards his own purposes. He knows about hate, now's how to feed it (racisms, blame, and vulnerability). 
He is a conductor, one born from the hate and misery of the american people who don't see a future, don't see hope, only a government who is bought and own by the 1%. Not a government by the people but for the few. This is how dictators are born. DICTATORS ARE BORN FROM A FAILED STATE.",0,2021-01-07T00:40:10Z,2021-01-07T00:45:04Z
@universologist1941,After 2020. I’m amazed that ppl still get emotional about stuff like this. I wouldn’t bat an eye if my dog started to fly all of a sudden.,0,2021-01-07T00:40:04Z,2021-01-07T00:40:16Z
@uriahheep5665,"Once the police are finished clearing out the Capitol of traitors, they should continue down Pennsylvania Ave and do the same at the White House.",0,2021-01-07T00:39:55Z,2021-01-07T00:39:55Z
@josemerinohankammer7261,They should charge fox news and all those conspiracy theorist with conspiracy to commit treason.,0,2021-01-07T00:39:45Z,2021-01-07T00:39:45Z
@uriahheep5665,"""If we nominate Trump, we will get destroyed.......and we will deserve it."" Lindsey Graham 2016.",3,2021-01-07T00:39:12Z,2021-01-07T00:39:12Z
@yeevue2857,Same corrupted people and leaders!,0,2021-01-07T00:39:05Z,2021-01-07T00:39:05Z
@thauria,"Brainwashed from a thug. So if he says to go burn your constitution and laws, I'm sure he's sheeps army will do it… What had happen, in my point of view and from your North neighboring country: Thrump is no better than Ben Laden.",0,2021-01-07T00:38:32Z,2021-01-07T00:38:32Z
@Kelly-bw1zo,It's unbelievable how many people are so racist in America. I can't believe how many people voted for Trump. How many people are so unintelligent and ignorant!!!,0,2021-01-07T00:38:22Z,2021-01-07T00:38:22Z
@macroman52,"Totally believable day, since we surely knew it was coming.",6,2021-01-07T00:38:09Z,2021-01-07T00:38:09Z
@chrisseiler7856,These people need to be tried and executed as traitors. Just to show this is what happens when you try to over throw the government,0,2021-01-07T00:38:06Z,2021-01-07T00:38:06Z
@alfredkay3210,"I HAVE BEEN TELLING THESE MEGA PEOPLE THAT THEY HAVE BEEN DEALING WITH A
 CON ARTIST ALL THESE YEARS  AND THEY DON'T EVEN KNOW IT.
TRUMP IS SIMPLY A VIRUS WRITTEN BY THE RUSSIAN TO INFILTRATE THE 
REPUBLICAN PARTY, INFECT IT AND DESTROY IT WITHIN AND VIRUS TRUMP HAS 
DONE JUST THAT. 
MEGA,REPUBLICANS, WHY DO YOU ALLOWED A GUY WHO IS A LIBERAL ALL HIS LIFE
 TO COME AND HIJACKED YOUR PARTY AND TOOK IT OVER AND YOU ARE ALL 
WORSHIPING HIM?
AT THIS POINT YOU NEED A STRONG VIRUS CLEANER TO CLEANUP YOUR PARTY AS 
IT HAS BEEN INFECTED BY VIRUS TRUMP!",0,2021-01-07T00:38:05Z,2021-01-07T00:38:05Z
@debbieflaherty4846,"What needs to happen....SNIPERS!!     Start picking them off!!

  This is the first time in my lifetime this has happened....BECAUSE TRUMP HAPPENED!! 
  I just heard rudy also encouraged this disrespectful bullshit! His....and trump’s ass need arrested RFN!! 
  There had BETTER be SEVERE CONSEQUENCES for this! If not...I HOPE THE AMERICAN PEOPLE WILL TAKE THE LAW INTO THEIR OWN HANDS!",0,2021-01-07T00:37:33Z,2021-01-07T00:37:33Z
@grantbuttenshaw,They have got very violent...bs. They haven't done shit..they are taking selfies!,0,2021-01-07T00:36:49Z,2021-01-07T00:36:49Z
@dougsteel7414,"This was always there in America just below the surface, Trump is just a focus.",0,2021-01-07T00:36:36Z,2021-01-07T00:36:36Z
@Kelly-bw1zo,You are so fuckin right!!!!!!!!!!!!!!!,0,2021-01-07T00:36:11Z,2021-01-07T00:36:11Z
@HtownDrip,If he was removed from office when he was impeached we wouldn't have never gotten to this point.,194,2021-01-07T00:35:54Z,2021-01-07T00:35:54Z
@theultimatereductionist7592,STOP THE REPUBLICUNT STEAL!!,0,2021-01-07T00:35:15Z,2021-01-07T00:35:15Z
@IsmaelDemi1002,You forgot about your tee-shirt,0,2021-01-07T00:35:14Z,2021-01-07T00:35:14Z
@jeromebernstein2754,Lady did it is so sad,0,2021-01-07T00:35:03Z,2021-01-07T00:35:03Z
@alexinfinite7142,"Hey, what happened to all the good men with guns to shoot all the bad people with guns? Your country is done for :(",0,2021-01-07T00:34:51Z,2021-01-07T00:34:51Z
@tdawg713,"Yeah, I think I've had enough winning.",0,2021-01-07T00:34:48Z,2021-01-07T00:34:48Z
@steven4569,You just know Putin is bang'n his mistress while watching this on TV,0,2021-01-07T00:34:47Z,2021-01-07T00:34:47Z
@Starbuck-dr7yl,arrest Trump now.,0,2021-01-07T00:34:38Z,2021-01-07T00:34:38Z
@SCVIndy,Trump nightmare continues ..,0,2021-01-07T00:34:27Z,2021-01-07T00:34:27Z
@YTT718,The core of the problem is the basket of dispicables,0,2021-01-07T00:34:18Z,2021-01-07T00:34:18Z
@brotherbluto4524,"As far as I’m concerned, anyone continuing to support this fascist MAGA movement is an enemy and traitor to the United States. I view these fascist thugs with the same contempt as the confederacy who also engaged in treason against the US. May they all go to hell.",0,2021-01-07T00:34:15Z,2021-01-07T00:34:15Z
@HtownDrip,SPOT ON,0,2021-01-07T00:34:15Z,2021-01-07T00:34:15Z
@tanessajones2484,"Shouldn’t trump be held accountable for that girls death? He told his supporters to go to DC. Knowing they have guns!  Knowing these people are terrorist! He brainwashed his morons to kill for him! To tear the capital up! To threaten Pence! And it just goes on! Why aren’t any of these people being held accountable! I guess you have to be black and fighting for black folks rights,and trump wants to get a pic with a Bible before military and national guard is called! This women’s blood should be on trumps and republicans hands! Lock trump up!",0,2021-01-07T00:34:14Z,2021-01-07T00:37:26Z
@arterial,"Well done, USA 1%, you've earned this. Dumb down your voters over decades, gut education, stoke fear of the other and this is your reward. Congratulations.",0,2021-01-07T00:34:04Z,2021-01-07T00:34:37Z
@eworldRick,"Mid century new age conservatives are sick, this guy needs to calm down. They have been sick for 50 years! The weak sick state needs to arrest these shorted sighted traitors in office!",0,2021-01-07T00:34:00Z,2021-01-07T00:34:00Z
@lizmoore2180,"Why has he not been arrested for inciting a riot, at the least. Now murder as the woman who was shot has died.",0,2021-01-07T00:33:59Z,2021-01-07T00:33:59Z
@spiritlgmx8976,"Wow trump and his cult are crazy. Sedition, coup of state, democracy traitors woha and is happening in USA, amaaaazing",1,2021-01-07T00:33:40Z,2021-01-07T00:33:40Z
@alfa1duetto,This is what Democracy looks like without burning and looting.,0,2021-01-07T00:33:35Z,2021-01-07T00:33:35Z
@louisianastormz1022,💯,0,2021-01-07T00:33:31Z,2021-01-07T00:33:31Z
@xWithoutxAxCausex,It’s literally treason.,0,2021-01-07T00:33:27Z,2021-01-07T00:33:27Z
@cerboris521,"They asked 'What's the harm in humouring Trump'. This, This is the harm idiots.",0,2021-01-07T00:33:17Z,2021-01-07T00:33:17Z
@grilledcheeseandsoup1652,All involved need to be arrested for sedetion. This was not just a riot.,0,2021-01-07T00:33:05Z,2021-01-07T00:33:05Z
@eirvingdiaz7185,attempted coup Wednesday 6 January 2021,1,2021-01-07T00:33:01Z,2021-01-07T00:33:01Z
@uriahheep5665,The MAGAbilly Taliban being led by Donnie Bin Liesol.,0,2021-01-07T00:33:01Z,2021-01-07T00:33:01Z
@CarlaB1B2,THIS IS AN SHAMEFUL ACT OF TERRORISM. Make Terrorism a Federal Crime.,0,2021-01-07T00:32:49Z,2021-01-07T00:32:49Z
@argirypanagopoulos8928,supermax in colorado for trump,0,2021-01-07T00:32:35Z,2021-01-07T00:32:35Z
@jennifersutton512,"Whoa!  America! and American's, is hurting! The Pain! Is deeply felt. Due to lack of Leadership! Let's continue to be strong! Sometimes good people's has to go through the Storm's! Brighter Day's, is coming. Hold on my brother's and sister's. A change for the better is near. The Storm is almost over with. 🙏",0,2021-01-07T00:32:18Z,2021-01-07T00:32:18Z
@racheldelfin342,"This is a sad 😥 and horrible day for the United States 🇺🇸 of America.   As a veteran,  I'm appalled by the action taken by these militias.  There are processes in place to keep democracy in place.   Our forefathers must be rolling in their graves because there is an attempt to overthrow the government.  Shameful. 😔",1,2021-01-07T00:32:10Z,2021-01-07T00:32:10Z
@asanddy3531,Arrest everyone from Trump to those seditious senators,0,2021-01-07T00:32:05Z,2021-01-07T00:32:05Z
@uriahheep5665,The Hamberder Rebellion,0,2021-01-07T00:32:03Z,2021-01-07T00:32:03Z
@robertsimpson1312,He is a fired disgruntled employee and still has keys to the office....,0,2021-01-07T00:32:00Z,2021-01-07T00:32:00Z
@bentidy8951,Imagine how dangerous Trump could have been if his competence matched his ability to manipulate.,0,2021-01-07T00:31:46Z,2021-01-07T00:31:46Z
@sovietcupcakes328,"Amazing maga meltdown, absolutely pathetic hahahahahha.",0,2021-01-07T00:31:39Z,2021-01-07T00:31:39Z
@ddm220,Law will do almost nothing about any of this except denounce it !,0,2021-01-07T00:31:36Z,2021-01-07T00:31:36Z
@xWithoutxAxCausex,It’s alright cause it’s all white. But people saying that black lives matter get brutality. Nice.,0,2021-01-07T00:31:27Z,2021-01-07T00:31:27Z
@lynwill65,"These thugs are nothing less than domestic terrorists and should be charged accordingly. Can you imagine if these were Democrat protesters doing this, they would be shot on the spot.",0,2021-01-07T00:31:25Z,2021-01-07T00:31:25Z
@derekthegreat1114,If they don’t impeach that bum now then they just don’t want to. Ridiculous!,0,2021-01-07T00:31:11Z,2021-01-07T00:31:11Z
@caterinaliberatore9478,As a Canadian I can’t fathom how these people are going against their own constitution and freedom for a fair election. I guess all the racists came out of every hell hole to make America white again. Shameful.,0,2021-01-07T00:31:07Z,2021-01-07T00:31:07Z
@rustyshackleford6811,I dont see anything on fire at this peaceful protest hmm...🤔,0,2021-01-07T00:31:02Z,2021-01-07T00:31:02Z
@eluminaryxarrais7735,I kind of expected more of this really I'm surprised it hasn't happened more often maybe it will now,0,2021-01-07T00:31:00Z,2021-01-07T00:31:00Z
@bcuzicann6452,"All these enablers should be removed from their positions they don’t deserve to continue. The sad part is they were so “ unprepared “ if this was another type of mayhem there would’ve been sharp shooters, secret service in every tree, pothole, crevice and this would’ve never happened. This behavior is sad and embarrassing.",0,2021-01-07T00:30:58Z,2021-01-07T00:30:58Z
@thomasmackelly7685,The trump voter has failed America.,0,2021-01-07T00:30:14Z,2021-01-07T00:30:14Z
@uriahheep5665,"I know this is not a popular view, but the 25th should be reserved for serious cases of physical or mental disability. We should not abuse it.
No, we need to IMPEACH Trump for ""high crimes and misdemeanors"", hound him from office to never return. It could happen in a day, based on the public record.
Impeachment would destroy Trump, and destroy him we must.",0,2021-01-07T00:30:10Z,2021-01-07T00:30:10Z
@bentidy8951,I'm wondering how Trump will blame  Obama and 'ChYnaa' for this. In the UK a trump is a fart. How apt.,0,2021-01-07T00:29:37Z,2021-01-07T00:29:37Z
@sharonrozier4984,When these same folks show up at McConnell's house how will he see it then?,3,2021-01-07T00:29:21Z,2021-01-07T00:29:21Z
@bobby-belgian2053,Couldn't find any right wing troll in the comments have they finally learnt shame? I doubt it they might all be their way to Washington.,0,2021-01-07T00:29:19Z,2021-01-07T00:29:19Z
@nebtheweb8885,The woman that got shot has died.,0,2021-01-07T00:29:00Z,2021-01-07T00:29:00Z
@shirrellredeye,"This is beyond pathetic. Used to be protestors, now they're terrorists.",0,2021-01-07T00:28:44Z,2021-01-07T00:28:44Z
@uriahheep5665,"“We totally condemn this arson!”, say the old white men who handed them the matches and gasoline.",209,2021-01-07T00:28:39Z,2021-01-07T00:28:39Z
@winstonchurchill3307,Dude looks nervous today. He can share a bunk bed with Biden in jail 😂,1,2021-01-07T00:28:05Z,2021-01-07T00:28:05Z
@mamaducksc,"Me, tearing up in Target. This is so much.",9,2021-01-07T00:27:41Z,2021-01-07T00:27:41Z
@antoniocapone661,HIGH TREASON,0,2021-01-07T00:27:27Z,2021-01-07T00:27:27Z
@mayleetan6518,US is degrading into a third world nation. This is result of democracy. People can do what they like,0,2021-01-07T00:27:24Z,2021-01-07T00:28:21Z
@cheeyahya2570,L,0,2021-01-07T00:26:24Z,2021-01-07T00:26:24Z
@sharonrozier4984,What happens to trump now! Can charges be applied here?,0,2021-01-07T00:26:21Z,2021-01-07T00:26:21Z
@KhurtKhave669,"Silly, you can't have a coup in a police state, that time was gone decades ago.",0,2021-01-07T00:26:19Z,2021-01-07T00:26:19Z
@appelblossom4311,Any Senator that was involved with this insurrection or sedition or coup needs to be censured for the remainder of their term and never be able to run for politics again un acceptable what just went down today this was not a protest this was an attempted coup !,0,2021-01-07T00:26:17Z,2021-01-07T00:26:17Z
@davidsignor7931,I certainly hope Trump will believing the WH,0,2021-01-07T00:26:13Z,2021-01-07T00:26:13Z
@PDIcomics,"I think this whole business with the Capitol protests is much ado about nothing. They didn’t actually hurt anyone. The BLM and Antifa were dragging random White people out of their cars and smashing their heads and killing them right and left after George Floyd overdosed in police custody, but these people in DC didn’t really cause much damage.",0,2021-01-07T00:25:57Z,2021-01-07T00:25:57Z
@johnvogel5722,"When will Anyone mention that ""Antifa, just means antifacishts?"" It's an idea, a self preservation notion. There are no leaders to us. Just ideas. Republicans have just stepped up to the plate thinking that democrats and progressives are their enemies. Duh. We want Justice and Democracy for the entire nation. Ignorance patience has run out. Later Trump later Mich, Loeffler, ...all I I 've you",0,2021-01-07T00:25:47Z,2021-01-07T00:25:47Z
@syrzelhenderson442,"If we do not pull it together as a country and a people America is doomed, sad but true!!",6,2021-01-07T00:25:46Z,2021-01-07T00:25:46Z
@ckmo2223,"They did held him  acountable they stopped his Twitter  account  for 12 hours ,sad",0,2021-01-07T00:25:27Z,2021-01-07T00:25:27Z
@LisaLightning,Watch GRAYZONE for actual intelligent investigative news by progressive journalists!!,0,2021-01-07T00:24:59Z,2021-01-07T00:24:59Z
@bentidy8951,"These guys don't know how to protest. No singing, chants or any creativity. Like everything Trump is involved in it was ineffective and inept. Protests should be about making a statement- sending out your message. This felt weird. It was a pack of betas trying to show their alpha how brave they were. That meant there was continual one upmanship going on leading to them storming in. I doubt most folk were there to do that.",0,2021-01-07T00:24:59Z,2021-01-07T00:24:59Z
@fmayer1507,Sadly person shot inside US Capitol has died.  Unfortunately the tribal mentality has deadly consequences.,0,2021-01-07T00:24:53Z,2021-01-07T00:24:53Z
@sharonrozier4984,More proof that if you are white you can get away with anything with law enforcement.,0,2021-01-07T00:24:22Z,2021-01-07T00:24:22Z
@rosiewalker2455,Trump needs to be removed from office now!,0,2021-01-07T00:24:00Z,2021-01-07T00:24:00Z
@tanyawales5445,"It's time for Pence to grow a pair and put Article 25 Section 4 of the Constitution into effect:

The 25th Amendment, proposed by Congress and ratified by the states in the aftermath of the assassination of President John F. Kennedy, provides the procedures for replacing the president or vice president in the event of death, removal, resignation, or incapacitation.  The Watergate scandal of the 1970s saw the application of these procedures, first when Gerald Ford replaced Spiro Agnew as vice president, then when he replaced Richard Nixon as president, and then when Nelson Rockefeller filled the resulting vacancy to become the vice president.  Read more from the Congressional Research Service here....

Amendment 25 Section 4.
Whenever the Vice President and a majority of either the principal officers of the executive departments or of such other body as Congress may by law provide, transmit to the President pro tempore of the Senate and the Speaker of the House of Representatives their written declaration that the President is unable to discharge the powers and duties of his office, the Vice President shall immediately assume the powers and duties of the office as Acting President.
Thereafter, when the President transmits to the President pro tempore of the Senate and the Speaker of the House of Representatives his written declaration that no inability exists, he shall resume the powers and duties of his office unless the Vice President and a majority of either the principal officers of the executive department or of such other body as Congress may by law provide, transmit within four days to the President pro tempore of the Senate and the Speaker of the House of Representatives their written declaration that the President is unable to discharge the powers and duties of his office. Thereupon Congress shall decide the issue, assembling within forty-eight hours for that purpose if not in session. If the Congress, within twenty-one days after receipt of the latter written declaration, or, if Congress is not in session, within twenty-one days after Congress is required to assemble, determines by two-thirds vote of both Houses that the President is unable to discharge the powers and duties of his office, the Vice President shall continue to discharge the same as Acting President; otherwise, the President shall resume the powers and duties of his office.

Option 2 is the quickest way using a majority of the Congress. With today's near death experience I am certain that the Congress will vote for this. VP Pence can use metal illness, drug addiction (Adderal) and dementia/Alzheimer's on the part of the President as the reason for his stating the President is incapacitated. This will get Trump out of the way for the rest of his term.",0,2021-01-07T00:23:08Z,2021-01-07T00:23:08Z
@SmegInThePants,"They will see this is a success, however badly for them it ends.  It'll create villains that they'll see as heroes.   It'll become right wing folklore.  It will embolden them in the future.  No matter how much it fails they'll just see it as strategic errors that need to be improved upon next time.  Radicalization will surge, even if only in the background.  No shortage of snake oil salesmen who will capitalize on fears and anger, fanning the flames, some of whom will be elected officials themselves, using this very incident as their new dog whistle going forward.  

I would absolutely love to be wrong.  I can hope that once their pied piper is gone that they'll be less emboldened and less willfully blind to indisputable facts.  Nothing wrong w/disputing facts, w/being skeptical, and investigating facts to corroborate them, good journalists for instance corroborate their facts before reporting them as a matter of procedure (the good ones that is) - but there *is* something wrong w/refusing to accept reality even after transparent investigation by unbiased parties verify those facts.  If you can't even imagine a fictional scenario that could possibly get you to admit you are wrong about something, whatever the subject matter, whichever side of an issue you are on, then you are off the deep end, you are dogmatic, closed minded w/an iron door.  Democrats need to be less afraid to call out things for what they are.  Less afraid of confrontation.  Scratch that, The People, of all political stripes, need their elected officials, of all political stripes, to be less afraid to stand up for rule of law (actual rule of the actual laws that are actually on the books that is), even against members of their own party.   Less tribalistic, or in the very least to consider their tribe to be all of america.  And we obviously need better ways to hold our elected accountable for their actions and failures.  

And more transparency.  If I'm a fear monger, it will be more difficult for me to get you to believe crazy conspiracy theories about politician X the more free and easy and trusted and well known access you have to relevant information about politician X, including his communications, donors, campaign funds, property holdings, all in one easy to access free to access place.  

I can't believe I miss the days when 'crazy right wing' just meant the religious zealots who wanted prayer in schools, to dictate who could get married, to gut federal programs, etc...  Oh how naive we were to think that was such a problem.",0,2021-01-07T00:22:23Z,2021-01-07T00:22:23Z
@rustyshackleford6811,The woman shot in the neck was not armed.. tell em cenk liar 🖕,0,2021-01-07T00:22:06Z,2021-01-07T00:22:06Z
@steven4569,Police chief must resign immediately and seditionists need to be arrested.,178,2021-01-07T00:21:56Z,2021-01-07T00:21:56Z
@josiahcanterbury1741,All Trump supporters are terrorists.,1,2021-01-07T00:21:41Z,2021-01-07T00:21:41Z
@sophiawilson8696,I heard the woman is dead. There are complaints that no security guards and was told to stand down if we're BLM or Antfia it would be lot worse.,0,2021-01-07T00:21:37Z,2021-01-07T00:22:13Z
