User,Comment,Likes,Published At,Time Ago
@briank8136,We have learned so much since that day. Still a way to go for justice over all of this treason.,0,2023-10-14T01:29:08Z,2023-10-14T01:29:08Z
@EmperorKagato,Coming back here as Jay Johnston has been arrested.,0,2023-07-12T16:45:08Z,2023-07-12T16:45:08Z
@ferox965,Trump will do it again.,3,2023-06-29T16:47:29Z,2023-06-29T16:47:29Z
@mikep6979,No offense but Sam looks ten years younger than he looks now.,1,2023-05-09T21:01:21Z,2023-05-09T21:01:21Z
@lordvadertheleftie9703,Let the hate flow through you Emma,0,2021-01-17T18:41:04Z,2021-01-17T18:41:04Z
@MikeySkywalker,3:50 Spot on,1,2021-01-13T11:22:56Z,2021-01-13T11:22:56Z
@gregoryspangler5775,LIKE IT'S SAYS IN THE BIBLE. U REAP WHAT SOW😈😈😈,1,2021-01-12T04:54:45Z,2021-01-12T04:54:45Z
@gregoryspangler5775,U GO EMMA...KEEP IT REAL BABY!!!,1,2021-01-12T04:39:22Z,2021-01-12T04:39:22Z
@rodneygratz3239,Emma: rethink that makeup!,0,2021-01-11T20:38:10Z,2021-01-11T20:38:10Z
@dabblindipshit,Feet on pelosi’s desk???)!!!!!! The nerve to touch her piece of wood.,0,2021-01-11T18:57:12Z,2021-01-11T18:57:12Z
@patrickbaillargeon8051,Amerika is one sick place.,0,2021-01-11T10:05:45Z,2021-01-11T10:05:45Z
@gawkthimm6030,"A line of rioters shot dead on the steps as a warning, then they could have piled them up easy in tight kill zones in the entranches with automatic fire, used their dead bodies to block their way",0,2021-01-10T21:29:27Z,2021-01-10T21:29:27Z
@canuckinsk,Where's all the video? There were countless cameras there.,0,2021-01-10T19:29:58Z,2021-01-10T19:29:58Z
@duckingforcover09,Is it worth watching the video of the woman being shot? Normally I wouldn't watch something horrific like that but Mat said it was worth it to see how the police reacted.,0,2021-01-10T19:13:13Z,2021-01-10T19:13:13Z
@thomaskoning3985,Emma is such a good choice for the Majority Report.,1,2021-01-10T18:26:47Z,2021-01-10T18:26:47Z
@jeremygwynn,emma. is. pissed.,0,2021-01-10T17:08:59Z,2021-01-10T17:08:59Z
@neilmoore7194,"Sam, the reason that some of the police were terrified was because some of there fellow officers did not ""have their backs "".  Some of them were on the side of the insuectionists.",1,2021-01-10T09:34:05Z,2021-01-10T09:34:05Z
@markbrownner6565,4 dead in libya and 2 year investigation...5 dead here now what..?? if they had 'captured' any hated politicians there would have been serious beatings and mayhem....,0,2021-01-10T05:56:15Z,2021-01-10T05:56:15Z
@patpowers9210,"Sam's live show was on during the capitol break-in. People on his feed kept pointing out what was going on and how wild it was. Sam pretty much ignored it all, except for briefly showing a video of it. He just kept going with whatever he was bloviating about. Talk about bad journalistic instincts! I was floored. Changed my opinion of Sam instantly.",0,2021-01-10T05:52:46Z,2021-01-10T05:52:46Z
@danawakes2001,Love your show guys but 720p in 2021?,0,2021-01-09T22:33:11Z,2021-01-09T22:33:11Z
@skengels,"The majority report.
The home of the brunch liberals.",2,2021-01-09T21:55:12Z,2021-01-09T21:55:12Z
@MrChewy79,The clip of Trump telling people they need to be strong is so sinister it’s not true,0,2021-01-09T21:28:29Z,2021-01-09T21:28:29Z
@MHO999999,One of the riot's fatalities was a Georgia woman trampled to death by the huge MAGA crowd.,0,2021-01-09T21:06:19Z,2021-01-09T21:06:19Z
@RedcoatT,One of the rioters who died in the coup died of a heart attack after he accidentally tasered himself in the groin.,1,2021-01-09T20:20:58Z,2021-01-09T20:20:58Z
@michaelbartlett6864,"When the rioters overran the Capitol building they became a ""Lynch Mob"" and should have been met with deadly force! I shudder to think what might have happened if the mob could have found Pelosi or other members of the Democratic Party!",0,2021-01-09T19:24:38Z,2021-01-09T19:24:38Z
@MH-gl1lt,Didn't I see police waving people on? Nos they're scared?,0,2021-01-09T18:42:47Z,2021-01-09T18:42:47Z
@donnadicasa,Just seconds before that cops got talked out of the way and stepped away from the door.,0,2021-01-09T18:07:47Z,2021-01-09T18:07:47Z
@Winstonclawfinger,You made your bed Yanks.  Have fun and enjoy.  You deserve everything that is coming.,0,2021-01-09T09:09:58Z,2021-01-09T09:09:58Z
@jessehenderson2967,Emma got her red hot angry lipstick for the terrorists.,0,2021-01-09T07:45:24Z,2021-01-09T07:45:24Z
@thehemorrhoidhut9206,"i didn't even watch this but it sucks, honestly",0,2021-01-09T07:38:53Z,2021-01-09T07:38:53Z
@donniekraus1273,"BREAKING NEWS

BISON BOY KILLED  IN SHOOT OUT WITH FBI",0,2021-01-09T07:11:20Z,2021-01-09T07:11:55Z
@ronnantab,The shooting video shows the shooter wearing a blazer.  Is that police or secret service?  Emma's comment that security shot seems more accurate than Sam saying Capitol Police.  More logical that Secret Service was not as lax as the Capitol Police and so when the women breached whoever they were protecting (Pence? Pelosi? Others?) they shot and neutralized the attacker.  Shot in the neck suggests higher level of training also.,0,2021-01-09T04:28:36Z,2021-01-09T04:28:36Z
@TrashHeapCustodian,"Hey guys

Just wanna say

Props for getting the 2021 intro in there so quick this year, I know it took a while last time",0,2021-01-09T02:49:50Z,2021-01-09T02:49:50Z
@railroadtrash09,"Had it been BLM, no cop would have survived.",0,2021-01-09T01:42:57Z,2021-01-09T01:42:57Z
@rezfarooque235,That’s white privilege for you,1,2021-01-09T00:17:09Z,2021-01-09T00:17:09Z
@jcusper365,"Interesting to see the ""blue lives matter"" flag carried by the crowd that kills cops. No problem for MAGA cult to reconcile it.",2,2021-01-08T23:54:12Z,2021-01-08T23:54:12Z
@Sagan_Blandard20XX,"The GOP encouraged this behavior for months, then hid in secret tunnels scared to death when their buddies showed up.",0,2021-01-08T22:43:25Z,2021-01-08T22:43:25Z
@bigbaddawg101,The terrorists killed a police officer.,0,2021-01-08T22:32:15Z,2021-01-08T22:32:15Z
@paulgallagher5889,"Both of my Grandfathers fought in WW2.  One was captured at the Battle of the Bulge, both came home with PTSD fighting fascists that sought to destroy our country and our planet.

We just had LITERAL NAZIS IN THE CAPITOL!!!  People waving Confederate flags in the halls of the Union Government!!!  Everyone complicit in this event needs to face jail time and be charged with TREASON.",4,2021-01-08T19:49:57Z,2021-01-08T19:49:57Z
@drehouse5733,"Hey TRUMP, what happened to When the LOOTING STARTS THE SHOOTING STARTS?, guess this doesn't go for the SPECIAL PEOPLE, YOU LOVE!",2,2021-01-08T19:20:14Z,2021-01-08T19:20:14Z
@helloman4251,that's hell of a lot of dumb people,2,2021-01-08T19:11:32Z,2021-01-08T19:11:32Z
@thefreestofspeech6951,"All people wanted was some transparency from the election. 
   But the establishment ignore them and now we're here. And the worst part is because I've gotten away with it they'll do it again.
    so I hope the progressive levels are ready because they're the next target.",0,2021-01-08T19:10:15Z,2021-01-08T19:10:15Z
@markc17,"I'm glad there weren't loads of armed police to create martyrs, that was probably Trump's plan, martyr creation.  Just a shame they didn't round up everyone who entered the building and give them 20 years in jail.",0,2021-01-08T18:30:48Z,2021-01-08T18:30:48Z
@Chimponaut,I need to hear what Ja Rule's thoughts are,0,2021-01-08T17:33:48Z,2021-01-08T17:33:48Z
@mrfuzztone,Ted Cruz needs to be held accountable. And Don Jr and Eric,3,2021-01-08T16:52:15Z,2021-01-08T16:52:15Z
@RicCortezMusic,Wow! Emma!  She's pissed.  Me too.,0,2021-01-08T16:48:12Z,2021-01-08T16:48:12Z
@LearningTheStixx,"Well if the left is consistent, she probably said something like, ""It never happened.""",0,2021-01-08T16:35:06Z,2021-01-08T16:35:06Z
@witHonor1,Why is Sam so confused? Moderate conservative.,0,2021-01-08T16:25:03Z,2021-01-08T16:25:03Z
@mr.dr0bot731,It's funny how the national guard was activated for BLM though. Black people have never done anything like this. This country is trash.,0,2021-01-08T16:23:13Z,2021-01-08T16:23:13Z
@mr.dr0bot731,Defund the mf police. They are clearly useless and complicit.,0,2021-01-08T16:17:26Z,2021-01-08T16:17:26Z
@mr.dr0bot731,They blamed this on black people so fast.,0,2021-01-08T16:14:26Z,2021-01-08T16:14:26Z
@1MarkKeller,"I find it strange that SWAT could get to her so quickly after she was shot, but where were they right before she was shot?",1,2021-01-08T16:06:40Z,2021-01-08T16:10:57Z
@graziousgirl,I think another reason why they didn't really wanna shoot in this case was because of the much higher possibility of those people shooting back. It's so much easier to shoot at or taser people who are mostly trying to keep things peaceful and are less trigger happy.,1,2021-01-08T16:02:33Z,2021-01-08T16:02:33Z
@XenonPrimeSBSV,"They had a freaking noose and gallows set up! What if they had actually gotten a hold of one the folks who's been demonised? 

Imagine if we had seen this mob lynching a member of Congress!",0,2021-01-08T15:56:35Z,2021-01-08T15:56:35Z
@ssilva8803,Sam and Emma are just the worst. Faux progressives who work against the people.,0,2021-01-08T15:22:56Z,2021-01-08T15:22:56Z
@Viksu53,"Americans speak with contempt about 'banana-republics"".  This 'form of government' was in fact American invention. 1901 author O.Henry  coined the term. He wrote about economic exploit of small countries by US corporations.  For example Honduras and Guatemala in Central-America.  So who we should speak with contempt.  Follow the money.",1,2021-01-08T14:29:10Z,2021-01-08T14:29:10Z
@mercoid,"Must install a concealed, easy to deploy, wide dispersement microwave weapons system at all entrances and foyer of the capital building. Because you can never have enough personnel on ready to handle anything like this without such a means of defense, unless you opt to mow them down with machine guns. Which is obviously very problematic in many ways.",0,2021-01-08T14:10:43Z,2021-01-08T14:25:18Z
@thomasmendola1015,"Put in Youtube search bar:
""Explosive Testimony Exposes MORE Evidence of Election Fraud!""",0,2021-01-08T14:07:58Z,2021-01-08T14:07:58Z
@Mizzy3030,"One thing is abundantly clear: Police unions should not be allowed to endorse political candidates. I'm sorry, but I can't take the police seriously, when I know that they overwhelmingly support Trump politically and financially.",7,2021-01-08T13:43:50Z,2021-01-08T13:43:50Z
@NG-ww9gv,I'm curious to know why no one is pointing out that they didn't have firearms? How does a mob of people get into the bloody capital without weapons?!,1,2021-01-08T13:42:06Z,2021-01-08T13:42:06Z
@ksk9984,"This is Something You'll See in a Movie , Not in Real Life...🤯😱",0,2021-01-08T13:36:29Z,2021-01-08T13:36:29Z
@xTheOxx,"The police appearing ""unprepared"" looks to me like confusion arising from knowing part of their colleagues actually wanted the storming of the Capitol to happen. It's hard to reconcile the spirit of brotherhood in a given force and the idea that you are under siege by a group your brothers sympathise with.",9,2021-01-08T13:33:16Z,2021-01-08T13:33:16Z
@TheFly212,"No the cops were in on it. Clearly. The vids are circulating around the net showing cops letting the rioters trumper scum in, taking pictures with them, high fiving them. So... Yeah.",1,2021-01-08T12:49:38Z,2021-01-08T12:49:38Z
@tness93,Wher was G.I.Crenshaw in all of this,1,2021-01-08T12:40:52Z,2021-01-08T12:40:52Z
@amandawight7124,And who is paying for all the damage?,0,2021-01-08T12:30:59Z,2021-01-08T12:30:59Z
@amandawight7124,He should be tried for insurrection,0,2021-01-08T12:20:38Z,2021-01-08T12:20:38Z
@Aeroil,"if capitol police were terrified, it was only because they didn't want to hurt their buddies.",2,2021-01-08T12:04:57Z,2021-01-08T12:04:57Z
@mariamkarjiker301,It is clear as daylight that the police were unwilling to restrain white protesters. Total racist double standards!!! I think that is probably a global thing where the police are less violent in their response towards protesters who are white.,1,2021-01-08T11:32:21Z,2021-01-08T11:32:21Z
@MrLarrycar,Emma don't use the word sacred when discussing the US gov. We are not a theocracy.,0,2021-01-08T11:28:52Z,2021-01-08T11:28:52Z
@scoobertmcruppert2915,"Yeah, I would have expected they would have come up those stairs, unloading those rifles and cleared that doorway.",0,2021-01-08T11:15:28Z,2021-01-08T11:15:52Z
@colinmccormack1728,"What are peoples thoughts on timing, namely the lack of discussion on the Georgia results, which could be seen as Trump’s revenge on McConnell",0,2021-01-08T10:30:32Z,2021-01-08T10:30:32Z
@HappyJack279,"This mob looked exactly like the US backed Christian fascist mobs we see in Latin America.
Chickens coming home to roost.",35,2021-01-08T09:39:45Z,2021-01-08T09:39:45Z
@maemorri,"Faith is a big part of a democracy.  I have to have faith that my vote will be counted.  I have to have faith that if I am accused of a crime I will get fair treatment by the legal system.  When I make a business deal I have to have faith that the other party will treat me fairly, or that I will have redress in the courts.  Trump supporters only have faith in Donald Trump even though he is internally inconsistent, illogical, and blatantly dishonest.",0,2021-01-08T09:11:21Z,2021-01-08T09:11:21Z
@virginiathomasakaicedragon6579,They should have known it was bullshit when he said he was going to walk with them. That man can't walk down three steps without help. He should have told them that they could do whatever and they would be the only ones go to jail.,2,2021-01-08T07:59:28Z,2021-01-08T07:59:28Z
@virginiathomasakaicedragon6579,"I think the higher ups knew everything. A few of the rank and file had to run home to put on their uniforms because they are a part of it. The rest were left hanging, they had more protection when Rev Sharpton had the March on Washington, which was peaceful by the way. Then it came down to Mike Pence to get the National Guard. The fingerprints of fuckery are all over this.",1,2021-01-08T07:46:47Z,2021-01-08T07:46:47Z
@davidwright834,"Trump shouted fire in a crowded theater, that's a crime.",1,2021-01-08T07:40:15Z,2021-01-08T07:40:15Z
@hughtubecube,Unsurprisingly Dimmy Jore is saying he’d give one of the protestors “a shot at Pelosi’s seat” because they would “do more for the people”,0,2021-01-08T07:34:40Z,2021-01-08T07:34:40Z
@agentsmidt3209,LMAO! WTF? I hadn't seen his speech up to now. That plexiglass with him behind it is ridiculous and hilarious.,0,2021-01-08T07:18:22Z,2021-01-08T07:18:22Z
@thumbhead3370,"I dont know whats worse, if storming the capitol is what Trump wanted, or if he really has lost control of the mob he created.",0,2021-01-08T07:03:03Z,2021-01-08T07:03:03Z
@fourdegreeswarmer,Dude enough Epoch Times ads,0,2021-01-08T06:57:13Z,2021-01-08T06:57:13Z
@BenSalernoMedia,Cops were so terrified of Y'all Qaeda that they took the barricades down for them themselves and took selfies with them.,0,2021-01-08T06:55:39Z,2021-01-08T06:55:39Z
@Blubirdmoon111,HOUSE on Vacation? WTF?,0,2021-01-08T06:52:12Z,2021-01-08T06:52:12Z
@Blubirdmoon111,Trmp slowed them from putting out National guard.,0,2021-01-08T06:51:44Z,2021-01-08T06:51:44Z
@Blubirdmoon111,4 people died ...,0,2021-01-08T06:49:19Z,2021-01-08T06:49:19Z
@HigherHeartWarriorChannel,"The video of the woman being shot, the guys in flack jackets and with an ar-15 were the insurrectionists-not Capitol police",0,2021-01-08T06:43:17Z,2021-01-08T06:43:17Z
@shannonbloom4133,Cops were complicit.,0,2021-01-08T05:52:36Z,2021-01-08T05:52:36Z
@shannonbloom4133,"The cops walked the terrorists off the property, offering aid and then let them loose, releasing them to freedom. Only 41 arrests were made at the time.",2,2021-01-08T05:52:05Z,2021-01-08T05:52:05Z
@shannonbloom4133,"Wow. The Governor of Delaware really had some interesting stuff to report. The Secretary of Defense refused to answer phone calls to give authorization to send National Guard, Capitol Police Chief refused help from any other agency and only deployed 500 of 2,000 person force.",3,2021-01-08T05:50:17Z,2021-01-08T05:50:35Z
@christinecummings1126,"The 5th person died tonight, a police officer",0,2021-01-08T05:46:39Z,2021-01-08T05:46:39Z
@coogallypuff,Love Emma and her contributions to the show,7,2021-01-08T05:41:08Z,2021-01-08T05:41:08Z
@mysterioso2006,I just have to wonder how differently things would've gone if everyone knew that 2k checks were coming....,1,2021-01-08T05:13:05Z,2021-01-08T05:13:05Z
@ilinfestissumam3232,"The Capitol police wasn't scared. They opened the barricades and let them walk in, they also took selfies with the people inside the Capitol, and even helped an elderly terrorist down the stairs. The police let it happen. The videos are everywhere.",0,2021-01-08T04:25:06Z,2021-01-08T04:27:27Z
@BlunderDownUnder,I believe the woman was shot my the Secret Service (Pence's detail).,0,2021-01-08T04:06:29Z,2021-01-08T04:06:29Z
@ElaineLoyd,Is anyone still holding out for 21' to be better than 20'. Personally I'm going to give 21' until March 13th to get it's act together.,3,2021-01-08T04:06:01Z,2021-01-08T04:57:51Z
@whatisagent5629,Bread and circus for the minions.,0,2021-01-08T03:54:54Z,2021-01-08T03:54:54Z
@johnnyjet3.1412,probably a bad reaction to tear gas - That is a real thing,0,2021-01-08T03:53:35Z,2021-01-08T03:53:35Z
@MrFlseabee,"Who won in all this? This was a setup, the left used the Trump minions as pawns by letting them storm the Capitol and holding it for four hours.  The FBI by their admission had know about this attemp for weeks and was no where to be found. They have blood on their hands as the Capitol police and the left does.",0,2021-01-08T03:53:20Z,2021-01-08T03:53:20Z
@cadene5498,I’m not surprised and yet my mind is blown. Just disgraceful.,0,2021-01-08T03:45:28Z,2021-01-08T03:45:28Z
@degaulle30,"Reminds me of what we had in Britain recently. 
Tommy Robinson getting imprisoned (again) led to days of skinheads rioting in London. The police honestly looked surprised that white people were hurling bricks at them. In many cases the police actually ran from the crowd. It was pretty scary considering we don't really have anything beyond unarmed police in the UK.",0,2021-01-08T03:44:06Z,2021-01-08T03:44:06Z
@babyfactory587,Hey.. they didn’t smash up the mall. That’s what I was really concerned about,0,2021-01-08T03:28:45Z,2021-01-08T03:28:45Z
@MrPhotodoc,I like it when Emma gets pissed.,0,2021-01-08T03:23:36Z,2021-01-08T03:23:36Z
@redhex__1738,Wish Emma got more time to talk,2,2021-01-08T02:58:13Z,2021-01-08T02:58:13Z
@hermeticmoth,I have the best sharpies. The strongest sharpies. No one has ever seen such strong sharpies.,0,2021-01-08T02:53:26Z,2021-01-08T02:53:26Z
@TheBlazersfan22,"Cops. omg black man trying show his ID. BAM BAM BAM BAM BAM! shoots a full case on the black man trying to show his ID.   Cop: I was terrified.   Cop : black man charging me !  i am terrified : bam bam bam bam . Shoots a full case on a man who stole cigs from a store.     Thousands charge .. trample police, beat the shit out of the cops .  almost breaking into congress.  only 1 bullet shot. 1 dead . not even using the full case like they do on a Black man.",0,2021-01-08T02:47:36Z,2021-01-08T02:47:36Z
@SurgeCess,Trump turned it into an offal office,0,2021-01-08T02:44:11Z,2021-01-08T02:44:11Z
@TheBlazersfan22,Fox and OANN- it was antifa fault for the riots. LUL . god they are just dumb.  they are trying so hard.,0,2021-01-08T02:41:55Z,2021-01-08T02:41:55Z
@Robotogram,"We need to turn ALL the ballots over to MAGA.  Let them do the recount then report the results, even pay them if possible.  At least for a while they will have something constructive to do.  They say “STOP THE STEAL” just give them the ballots and say “yes, stop the steal”.",0,2021-01-08T02:39:02Z,2021-01-08T02:42:17Z
@cesardelgado1033,And they were told not to worry about the police because they were on their side!,0,2021-01-08T02:38:43Z,2021-01-08T02:38:43Z
@freeheeler00,And now a cop has died too. Do blue lives still matter or not? Which is it?,0,2021-01-08T02:35:34Z,2021-01-08T02:35:34Z
@DaveTerrasidio,crazy,0,2021-01-08T02:30:15Z,2021-01-08T02:30:15Z
@llongone2,"This is the first time our capital has been attacked since 9/11, when  a plane was flown into the Pentagon. It's the first time buildings in the capital were invaded since the War of 1812. America has been attacked by terrorists...who were not wearing masks. Their faces appear on video. Let's round them up and put these dangerous, anti-American, anti-democratic terrorists behind bars. All of them...including their leader, tRump.",0,2021-01-08T02:28:14Z,2021-01-08T02:28:14Z
@kenharrison4413,"Yes this was bad, also it was bad when Bret K rioters invaded the senate house, even though the media prtrayed that as a good thing.",0,2021-01-08T02:27:41Z,2021-01-08T02:27:41Z
@berdyderg900,Any clip without nomiki = thumbs up,2,2021-01-08T02:23:41Z,2021-01-08T02:23:41Z
@ManOfUnknownWorth,"I have seen the centrists calling the Left hypocrites for condemning this while supporting the Black Lives Matter protests. Although there is more to it than that, there is still that appearance of hypocrisy. Personally, I would rather focus on the double standard of treatment than anything else. There is nothing sacred about Congress.",0,2021-01-08T02:23:37Z,2021-01-08T02:23:37Z
@annec6200,"I thought about Emma yesterday. I was always afraid for her when she went to the rallies in the past. She was always professional but you would never know if anyone could snap and hurt her because that monstrous candidate was saying she was the enemy of the people.
It can’t be said too much how much I thought she was so brave to do that.",31,2021-01-08T02:20:29Z,2021-01-08T02:20:29Z
@crithon,"what if, he got this crowd to vote in georgia? what if he got this crowd to vote in november 3rd? He WASTED EVERYONE'S TIME FOR MONTHS! Claiming ""mail in ballots was a scam"" and instead he interrupted a ceremony, a ceremony for what? that's like kicking a daughter's tea party set, it doesn't make you king of the family.",1,2021-01-08T02:14:34Z,2021-01-08T02:14:34Z
@jds614,"The natural conclusion to the Trump Adminstration.

Imo in the last 2 months trumps character damage to the nation surpassed bush 43s more substantial policy damage",1,2021-01-08T02:10:06Z,2021-01-08T02:10:06Z
@eaglessixersfankeepingitre3247,"""Misty morning, clouds in the sky
Without warning, the wizard walks by
Casting his shadow, weaving his spell
Funny clothes, tinkling bell
Never talking
Just keeps walking
Spreading his magic
Evil power disappears
Demons worry when the wizard is near
He turns tears into joy
Everyone's happy when the wizard walks by"" - Black Sabbath

OH Sam, where art the wizard in these times of despair because evil powers materialized and the demons brought forth Hell with them to Capitol Hill with nary wizard in sight?",2,2021-01-08T02:08:59Z,2021-01-08T02:08:59Z
@tomd4748,"Surprised? Inside job, bro. Be real.",1,2021-01-08T02:06:58Z,2021-01-08T02:06:58Z
@Semaglutide_30dayresults,"I understand this is pointless but could they subpoena the speech writer and ask them why they used this specific language and what was the purpose of using these words.? I am sure Trump did a Question and Answer session with the speech writer prior to the person writing this speech. Can we use this to show intent to incite the violence to to help determine what he was intending to do or motivate when giving this speech.  Could you imagine the hell Republicans would have raised if Democrats did this? Again we are being to passive, WTF.  If democrats don't get some policy shit done over these next two years this will break America no more excuses. We need to grant statehood to Washington, DC and Puerto Rico expanding our majority in the senate and the house and change the rules and rescind funding and take the golden goose from states like North and South Carolina, Kentucky, Texas and Florida and we need to fund the fuck out of California and quit neglecting their needs. 1/8th of the US population resides in California and every chance they get every Republican dogs and belittles the state, its occupants and its leaders.",0,2021-01-08T02:05:32Z,2021-01-08T02:15:07Z
@axelfoley133,"I wonder if Blue Lives Matter condemned this riot that attacked capitol police. I had a quick look at their FB page... No open statement of condemnation, just a shared article about rioters being charged, no commentary about it.",2,2021-01-08T02:03:09Z,2021-01-08T02:03:09Z
@RoninDave,"A couple of ironic notes - 1) A Trump supporter ie Republican voter ie Party of Lincoln bringing a Confederate Flag into the Capitol in an act of aggression against the democratic process of the country Lincoln fought to preserve.

2) This group labels themselves patriots but fail to understand the law and Constitution of the country they profess to love as they storm the Capitol in support of a president who lost both the popular and electoral vote but refused to concede unlike any president before him. 

3) These chuckleheads thought they'd be cheered on by their MAGA brethren (which they were at first) but now they are being thrown under the bus and labeled Antifa operatives.

It just shows how much of a clown show rightwingers have become.",0,2021-01-08T02:00:29Z,2021-01-08T02:00:29Z
@blkbass1958,Emma is pissed!  I glad I’m not the only one.  Go get them girl!,68,2021-01-08T01:53:46Z,2021-01-08T01:53:46Z
@sponkmcdonk3898,"We could use a Kanye ""Donald Trump doesn't care about black people""

Oh wait, we're in upside down world..",30,2021-01-08T01:52:37Z,2021-01-08T01:52:37Z
@jeremyweaver7689,It was a mostly peaceful protest.,1,2021-01-08T01:47:11Z,2021-01-08T01:47:11Z
